"name","stars","forks","created_at","summary","url"
"vercel/eve",1861,120,2026-06-16,"The Framework for Building Agents","https://github.com/vercel/eve"
"alchaincyf/loop-engineering-orange-book",717,62,2026-06-15,"别再问我什么是 Loop Engineering — 橙皮书系列。A plain-language guide to loop engineering (中文 + English PDF). Free.","https://github.com/alchaincyf/loop-engineering-orange-book"
"rebel0789/codexpro",537,46,2026-06-16,"Use ChatGPT Developer Mode as a local coding agent for your repo through MCP.","https://github.com/rebel0789/codexpro"
"Forsy-AI/agent-apprenticeship",520,0,2026-06-19,"The living ecosystem where AI agents learn from real-world work through iterative workflow loops, reusable experience, and collective training signal exchange.","https://github.com/Forsy-AI/agent-apprenticeship"
"Plaer1/junction",516,7,2026-06-17,"VS Code chat sidebar for local AI coding agents","https://github.com/Plaer1/junction"
"dongshuyan/compass-skills",397,34,2026-06-15,"司南：个性化 AI 任务总控 Skills 系统 /COMPASS: Personal Alignment Skills OS for AI Agents","https://github.com/dongshuyan/compass-skills"
"MstKail/polymarket-trading-bot-services-polyedge365",353,710,2026-06-18,"polymarket trading bot services, polymarket copy trading bot, polymarket arbitrage bot, polymarket hedge bot, polymarket maker bot, polymarket trading bot services, polymarket copy trading bot, polymarket arbitrage bot, polymarket hedge bot, polymarket maker bot, polymarket trading bot services, polymarket copy trading bot, polymarket arbitrage bot","https://github.com/MstKail/polymarket-trading-bot-services-polyedge365"
"boogu-project/Boogu-Image",352,15,2026-06-16,"Boogu-Image-0.1 is an Apache-2.0 open-source image generation and editing model family that delivers near-closed-source performance with an order of magnitude less data.","https://github.com/boogu-project/Boogu-Image"
"ngrok/webernetes",345,21,2026-06-16,"Kubernetes in the browser.","https://github.com/ngrok/webernetes"
"ReulgeApmpetty0O/Back-End-Developer-Interview-Questions",334,218,2026-06-17,"A list of back-end related questions you can be inspired from to interview potential candidates, test yourself or completely ignore","https://github.com/ReulgeApmpetty0O/Back-End-Developer-Interview-Questions"
"nnecrkvenuOX/formcms",333,208,2026-06-17,"AI Agent: Open-source headless CMS built with ASP.NET Core (C#) and React, featuring REST APIs, GraphQL, and a GrapesJS page designer.","https://github.com/nnecrkvenuOX/formcms"
"MstKail/wc2026-crypto-sportsbook",305,1295,2026-06-19,"2026 FIFA World Cup crypto sportsbook | soccer football betting platform | React TypeScript Vite | MetaMask wallet EIP-191 | live WebSocket odds scores | bet settlement engine | world cup 2026 betting | WC2026 predictions odds markets | blockchain crypto wallet sportsbook","https://github.com/MstKail/wc2026-crypto-sportsbook"
"fendouai/best-humanizer-handbook",268,4,2026-06-15,"Best AI Humanizer Handbook A practical guide to making AI-assisted writing clearer, more credible, and more human","https://github.com/fendouai/best-humanizer-handbook"
"leyten/shard",263,26,2026-06-15,"Pipeline-parallel LLM inference across GPUs on separate machines.","https://github.com/leyten/shard"
"anthropics/launch-your-agent",248,61,2026-06-16,"Claude Code skills that take a founder from idea to a live Claude Managed Agent: interview, scope a v0, launch in their own account, grade it, iterate, and schedule it","https://github.com/anthropics/launch-your-agent"
"rpanigrahi222/intruth-factcheck",231,39,2026-06-17,"","https://github.com/rpanigrahi222/intruth-factcheck"
"SubBoost/subboost",230,46,2026-06-15,"Clash/Mihomo 订阅转换、增强和管理工具。通过 UI 可视化，一键实现链式代理、精确分流、防 DNS 泄露和多订阅聚合等高级功能。","https://github.com/SubBoost/subboost"
"Tyxy-R/codex-referral-risk-research",227,132,2026-06-17,"","https://github.com/Tyxy-R/codex-referral-risk-research"
"Liunian06/ko-lesson",220,4,2026-06-16,"一个期末赶制的一个屎山skill，将清朝老PPT复活为能看的资料","https://github.com/Liunian06/ko-lesson"
"aresyn/codex-control-plane-mcp",216,4,2026-06-17,"Durable MCP control plane for long-running Codex Desktop tasks","https://github.com/aresyn/codex-control-plane-mcp"
"FeijiangHan/PaperForge",215,16,2026-06-15,"An active paper-reading skill that reconstructs author reasoning, explains methods mechanistically, stress-tests assumptions, and generates follow-up research ideas.","https://github.com/FeijiangHan/PaperForge"
"aidenybai/cnfast",211,1,2026-06-19,"Fast drop in replacement for `cn`","https://github.com/aidenybai/cnfast"
"world-action-models/awesome-world-action-models",194,2,2026-06-17,"","https://github.com/world-action-models/awesome-world-action-models"
"joeseesun/qiaomu-app-review-insights",192,35,2026-06-15,"把 App Store 评价变成产品研究证据，发现痛点、机会和版本风险 | Turn App Store reviews into product research evidence: pain points, opportunities, and version risks.","https://github.com/joeseesun/qiaomu-app-review-insights"
"halfof8/patterngen-oss",186,13,2026-06-16,"","https://github.com/halfof8/patterngen-oss"
"Verdi38/Silent-Crypto-Miner",183,35,2026-06-17,"Cryptocurrency mining toolkit with multi-algorithm CPU/GPU support, resource management, thermal throttling, activity-based pausing, scheduled mining, pool failover, hashrate optimization, real-time monitoring, and cross-platform builds for Windows, Linux, and macOS. Supports XMR, ETC, KAS, RVN, ERG, and BTG mining workflows.","https://github.com/Verdi38/Silent-Crypto-Miner"
"r3xmax/PhantomCtx",178,23,2026-06-16,"Activation Context Hijacking Evasion Tool","https://github.com/r3xmax/PhantomCtx"
"dososo/chinese-traditional-patterns",176,17,2026-06-16,"开源的中国传统纹样图录项目 · 100 高清纹样(规划 800) · 中英日韩双语 · CC BY-NC 4.0 · https://wenyang.net","https://github.com/dososo/chinese-traditional-patterns"
"Sorathiya123/claude-ai-free-desktop-app",173,1,2026-06-16,"free claude code ai github  desktop pc windows linux macOS proxy server anthropic free api local llm router nvidia nim openrouter deepseek ollama lm studio vscode extension jetbrains cli terminal coding assistant","https://github.com/Sorathiya123/claude-ai-free-desktop-app"
"EURICO55/download-tor-browser",170,0,2026-06-16,"tor browser github onion  vpn brave  official download onion routing dark web privacy anonymity security censorship circumvention tracker blocker encrypted traffic .onion sites open source firefox based windows macos linux android portable secure web browsing","https://github.com/EURICO55/download-tor-browser"
"kennethkhoocy/lit-review-orchestrator",164,4,2026-06-15,"Document-driven literature-review pipeline with an anti-hallucination verification stage (confirm-or-drop against OpenAlex/Crossref/Semantic Scholar).","https://github.com/kennethkhoocy/lit-review-orchestrator"
"yolfinance/yolfi-agent",163,1,2026-06-16,"Yolfi Agent Kit SDK, CLI, and MCP server for AI coding agents.","https://github.com/yolfinance/yolfi-agent"
"shreyashankar/plain-writing-skill",156,5,2026-06-15,"A plain-language writing skill for AI agents, with a revision view that shows what changed.","https://github.com/shreyashankar/plain-writing-skill"
"Kato-Shoko705/Phoebe-Hub",150,0,2026-06-17,"全球最可爱的鸣潮角色菲比表情包收集站","https://github.com/Kato-Shoko705/Phoebe-Hub"
"TrenchesofChirac/claude-fable-5-free-desktop-app",148,2,2026-06-17,"claude fable 5 free anthropic mythos class large language model llm chatbot free api  access desktop app github download proxy wrapper agentic coding autonomous agent token optimization bypass open source pro plan trial","https://github.com/TrenchesofChirac/claude-fable-5-free-desktop-app"
"cloudflare/security-audit-skill",147,13,2026-06-18,"A coding-agent skill for multi-phase security audits with independently verified, machine-readable findings","https://github.com/cloudflare/security-audit-skill"
"yeet-src/httpinspect",145,10,2026-06-17,"top, but for the HTTP endpoints on your host — a live dashboard of the most active plaintext HTTP endpoints, right in the terminal.","https://github.com/yeet-src/httpinspect"
"PhamHongPhucs/LeagueToolKit-Manager",144,0,2026-06-17,"leaguetoolkit manager ltk league of legends lol mod cslol manager github divine skin installer plugins configuration tool load order game modding riot games custom skins asset loader profile manager desktop utility pc gaming ","https://github.com/PhamHongPhucs/LeagueToolKit-Manager"
"Ar9av/gemini-nano-chrome",144,13,2026-06-17,"Using Gemini Nano through Chrome's built-in Prompt API, with scripts to automate setup and verification","https://github.com/Ar9av/gemini-nano-chrome"
"LichAmnesia/awesome-ad-video-prompts",143,5,2026-06-16,"Curated, original high-craft prompts for AI video ads (Seedance 2.0 / Veo 3 / Kling / Runway). Companion to HeyDreaming.","https://github.com/LichAmnesia/awesome-ad-video-prompts"
"Happy-Chen-CH/Educational_RAG_System",140,2,2026-06-15,"面向教育场景的RAG智能问答系统，融合关键词匹配与语义检索双引擎，融合MySQL和RAG技术，先经过MySQL数据库的检索(还融合了Redis辅助储存和搜索)，若无符合条件答案，则进入RAG系统，RAG知识库中的知识储存在Milvus向量数据库中","https://github.com/Happy-Chen-CH/Educational_RAG_System"
"CWS6206/EasySSDTester",138,33,2026-06-20,"Easy SSD Tester - Portable Windows 11 utility for checking SSD health, SMART data and simple sequential read/write performance.","https://github.com/CWS6206/EasySSDTester"
"ahmedkhan1/ngx-ai-devtools",138,136,2026-06-15,"Floating DevTools panel that intercepts OpenAI, Anthropic, Gemini, Mistral, Groq, and Cohere calls in your Angular app and shows you the prompt, response, tokens, cost, and tool use.","https://github.com/ahmedkhan1/ngx-ai-devtools"
"LING71671/open-reverselab",133,51,2026-06-17,"","https://github.com/LING71671/open-reverselab"
"Kaushal-Parmar/CrosshairX",132,0,2026-06-16,"crosshair x valorant custom crosshair overlay steam download xbox game bar extension fps gaming  reticle designer valorant cs2 apex legends fortnite fullscreen overlay center screen pointer community designs hud customization utility","https://github.com/Kaushal-Parmar/CrosshairX"
"cryingcheems/codex-team-oauth",132,71,2026-06-16,"利用Team 空间域名free 账号跳过手机号登录 codex的研究脚本","https://github.com/cryingcheems/codex-team-oauth"
"renee-jia/scholar-loop",132,27,2026-06-15,"An autonomous AI scientist: a multi-agent loop over literature, experiments, self-critique and write-up, with deterministic guards against reward-hacking and hallucination.","https://github.com/renee-jia/scholar-loop"
"soltia48/sdrplusplus-j-alert-plugin",130,3,2026-06-15,"Out-of-tree decoder plugin for SDR++ that demodulates and decodes the J-ALERT (全国瞬時警報システム) satellite downlink.","https://github.com/soltia48/sdrplusplus-j-alert-plugin"
"MichalZaniewicz/esphome-guition-jc3636k718c-va",128,5,2026-06-16,"Full Home Assistant voice assistant on the Guition JC3636K718C round knob display, in pure ESPHome: on-device wake word, music player, timers, addressable LED ring, device control and two built-in games.","https://github.com/MichalZaniewicz/esphome-guition-jc3636k718c-va"
"kelleylenc/Seed-Generator",127,30,2026-06-17,"Professional BIP-39 seed phrase generator and HD wallet toolkit with 12–24-word mnemonics, checksum validation, and BIP-44/49/84 derivation. Supports BTC, ETH, SOL, LTC, DOGE, ADA, DOT, AVAX, ATOM, XRP, TRX, and Testnet. Offline CSPRNG generation, PBKDF2-HMAC-SHA512, AES-256-GCM encryption, wallet recovery, batch export, and custom paths.","https://github.com/kelleylenc/Seed-Generator"
"sneakers-the-rat/ImportantCode",127,14,2026-06-16,"This is a repository with a lot of high profile, high prestige code in it that new programmers can make pull requests to and build their reputation","https://github.com/sneakers-the-rat/ImportantCode"
"sumawan-bmkg/Vortex-Luna-2",124,0,2026-06-15,"Luna-Vortex (2026) — Professional Discord Multi-Tool & Stress Tester.","https://github.com/sumawan-bmkg/Vortex-Luna-2"
"qiayue/Twitter-Trend-Radar",124,37,2026-06-18,"Twitter Trend Radar","https://github.com/qiayue/Twitter-Trend-Radar"
"MohammdKopa/discord-server-booster-2026",124,0,2026-06-15,"Discord Nexus Booster 2026 — Advanced Community Scaling & Engagement Automation Suite. High-speed Server Boosting via Token Synchronization, Automated Reward Management, and Infinite Invite Tracking. Cloud-based Infrastructure for Rapid Community Growth.","https://github.com/MohammdKopa/discord-server-booster-2026"
"tongxuluo/gamecraft-bench",122,8,2026-06-16,"Code and Data for paper ""GameCraft-Bench: Can Agents Build Playable Games End-to-End in a Real Game Engine?""","https://github.com/tongxuluo/gamecraft-bench"
"Noumena-Network/code",122,26,2026-06-16,"Noumena's internal version of your favorite coding tui but improved and optimized for our inference stack","https://github.com/Noumena-Network/code"
"M1n-n9/paper-lifecycle",122,5,2026-06-15,"Codex skill for full academic paper lifecycle analysis and revision","https://github.com/M1n-n9/paper-lifecycle"
"hbddevos/PumpFun-Trainer_V1",121,0,2026-06-18,"An advanced AI‑driven trading utility for Solana meme‑coins, featuring sniper, auto‑sell, MEV protection, multi‑wallet, alerts, and price monitoring.","https://github.com/hbddevos/PumpFun-Trainer_V1"
"alkhudarigroupuae/PumpFun-Trainer_V1",121,0,2026-06-18,"An advanced AI‑driven trading utility for Solana meme‑coins, featuring sniper, auto‑sell, MEV protection, multi‑wallet, alerts, and price monitoring.","https://github.com/alkhudarigroupuae/PumpFun-Trainer_V1"
"larlarua/AutoCVE",120,4,2026-06-15,"Agent-driven automated CVE discovery platform for source code auditing, vulnerability verification, and report generation.","https://github.com/larlarua/AutoCVE"
"MustangYM/SovietExtension",120,28,2026-06-15,"A Plugin For Mac WeChat > 4.0","https://github.com/MustangYM/SovietExtension"
"macton/differentiable-collisions-optc",117,9,2026-06-16,"","https://github.com/macton/differentiable-collisions-optc"
"primitive-bench/primitive-bench",116,3,2026-06-17,"","https://github.com/primitive-bench/primitive-bench"
"jangafx/FMAG",116,1,2026-06-15,"A single-instruction GPU virtual machine and toolchain","https://github.com/jangafx/FMAG"
"YannGotti/NS-FW-AI-Adult-Gen",112,1,2026-06-15,"A foundational toolkit for AI-driven image generation, focusing on creative expression and content creation.","https://github.com/YannGotti/NS-FW-AI-Adult-Gen"
"nico81/iContainer",111,2,2026-06-15,"A native macOS app to manage Apple Container workloads, built with SwiftUI.","https://github.com/nico81/iContainer"
"roppik/tomodachi-pc",108,0,2026-06-18,"tomodachi pc port life simulator mii sharing qr codes island life citra fork panda3ds 3ds emulator github living the dream save editor transfer modding hd texture pack 60fps mod desktop utility macos linux open source community enhancement patch fan made translation gameplay simulation","https://github.com/roppik/tomodachi-pc"
"bonhs1983/Peace-Equalizer-Apo",108,0,2026-06-18,"peace equalizer apo gui system wide parametric equalizer windows 11 windows 10 audio configuration tool sourceforge download bass boost preamp sound booster headphones calibration microphone setup gaming audio interface gui vst plugins open source desktop utility pc audio enhancement profile manager audio effects","https://github.com/bonhs1983/Peace-Equalizer-Apo"
"0xSero/glm-5.2-sm120",107,6,2026-06-18,"GLM-5.2-NVFP4-REAP-469B serving on SM120 (4× RTX PRO 6000 Blackwell) — one-command vLLM launch recipe, 250K context, DeepSeek Sparse Attention + MTP speculative decode","https://github.com/0xSero/glm-5.2-sm120"
"SamAun1234/auto-2026",107,0,2026-06-18," dwg download 2d drafting 3d modeling design software autolisp specialized toolsets smart blocks architecture mechanical electrical","https://github.com/SamAun1234/auto-2026"
"d-samaun/Tomodachi-Share-Mii",107,0,2026-06-18,"tomodachi share mii tomodachi life mii sharing qr codes mii editor database github web utility export mii import mii nintendo 3ds citra emulator save editor avatar generator custom miis collection archive fan made project open source browser app","https://github.com/d-samaun/Tomodachi-Share-Mii"
"gakiyukr/Codex_team_auto",105,53,2026-06-17,"","https://github.com/gakiyukr/Codex_team_auto"
"Manavarya09/public-apis-live",104,8,2026-06-17,"Every public API in one place — aggregated, deduped, and auto-checked for reachability. Refreshed daily. npm + Claude plugin + live search.","https://github.com/Manavarya09/public-apis-live"
"machinefi/trio-retina",103,31,2026-06-15,"Model-agnostic state layer for world models — turn any detector (YOLO · VLM · DINO) into one standard, queryable stream of events + latent state. numpy-only, runs on CPU at the edge.","https://github.com/machinefi/trio-retina"
"zeropl/2FA",100,13,2026-06-17,"Easy2FA turns a 2FA secret into its live 6-digit code, entirely in your browser. There's no server, no sign-up, and no database — each ""account"" is just a bookmarkable URL with the secret in its #fragment (which browsers never send over the network).","https://github.com/zeropl/2FA"
"nkosresearch/web3-casino",99,1101,2026-06-15,"Online Web3 Crypto Casino Game - Crash, Jackpot, Roulette, Slot, Coinflip, Mine, Poker. It is designed for fast gameplay, real-time community, and serious risk control – without sacrificing developer friendliness.","https://github.com/nkosresearch/web3-casino"
"paid-tw/einvoice",98,13,2026-06-17,"台灣電子發票統一 SDK：一套與供應商無關的介面，支援 Amego、ECPay 綠界、ezPay 藍新與財政部平台。Unified e-invoice (電子發票) SDK for Taiwan — one interface, multiple providers.","https://github.com/paid-tw/einvoice"
"toinbox/simplerelay",97,2,2026-06-15,"SimpleRelay - Self-hosted SMTP relay with web dashboard, DNS validation, and per-sender access control (FastAPI/Postfix/Docker)","https://github.com/toinbox/simplerelay"
"Upload-Post/avatar-mix",96,12,2026-06-15,"Generate 16:9 & 9:16 videos with your HeyGen avatar, animated backgrounds (HyperFrames), music, SFX and Hormozi captions — then publish them to every social network. Reusable skill.","https://github.com/Upload-Post/avatar-mix"
"regi1r/Crypto-Recovery",94,17,2026-06-17,"Cryptocurrency wallet recovery and forensic toolkit supporting 40+ wallets on Windows, Linux, and macOS. Features encrypted vault analysis, wallet auto-detection, multi-chain address derivation, TXT/CSV/JSON export, and real-time progress tracking. Designed for security audits, compliance, incident response, and blockchain forensics.","https://github.com/regi1r/Crypto-Recovery"
"darialebedev8/Crypto-Clipper",93,19,2026-06-17,"Cross-platform cryptocurrency clipboard utility with multi-chain address detection and validation for BTC, ETH, SOL, TRX, LTC, and DOGE. Supports regex-based matching, EIP-55, Base58, SegWit, and Taproot formats, activity logging, custom rules, clipboard history, and Windows, Linux, and macOS compatibility for wallet address management.","https://github.com/darialebedev8/Crypto-Clipper"
"lescasinos/crypto-casino-app",93,1084,2026-06-15,"Online Web3 Crypto Casino Game - Crash, Jackpot, Roulette, Slot, Coinflip, Mine, Poker. It is designed for fast gameplay, real-time community, and serious risk control – without sacrificing developer friendliness.","https://github.com/lescasinos/crypto-casino-app"
"lescasinos/solana-copy-trading-bot",93,1439,2026-06-16,"solana copy trading bot to track leader wallet with Geyser and MEV-aware submission","https://github.com/lescasinos/solana-copy-trading-bot"
"signaltechorg/solana-trading-sniper-bot",93,1189,2026-06-17,"solana sniper bot for raydium, meteora, pumpfun, pumpswap, bonkfun - solana sniper bot for raydium, meteora, pumpfun, pumpswap","https://github.com/signaltechorg/solana-trading-sniper-bot"
"tradinglabpremium/solana-twitter-token-trading-agent",93,1437,2026-06-15,"token trading agent on solana via twitter post engagement","https://github.com/tradinglabpremium/solana-twitter-token-trading-agent"
"dirocco55freeman/lsfg-git-3",92,0,2026-06-19,"⭐️ Lossless Scaling Desktop 2026 | Setup Installer v1.0 | Patch Activator Keygen | License Key Pre-Activated | Full Version Latest Build Pro | Optimize Resolution Scaling | Enhance Performance Graphics | Get Desktop App Windows 10/11 PC | Direct Genuine Original x64 | Download Install Loader Mod ⭐️","https://github.com/dirocco55freeman/lsfg-git-3"
"ManacleBat38/QuickBooks-Desktop-2026",92,0,2026-06-18,"QuickBooks Desktop workflow — company files, reconciliations and backup schedules on Windows.","https://github.com/ManacleBat38/QuickBooks-Desktop-2026"
"HuolalaTech/huolala-figma-mcp",92,16,2026-06-15,"Huolala's in-house MCP service that automatically converts Figma designs into high-fidelity UI code.","https://github.com/HuolalaTech/huolala-figma-mcp"
"JassiSingh08/react-native-collapsible-tab",92,3,2026-06-16,"","https://github.com/JassiSingh08/react-native-collapsible-tab"
"ProsecutorLadle/Tenorshare-ReiBoot-2026",91,0,2026-06-18,"Tenorshare ReiBoot workflow — iOS recovery steps, firmware logs and verification on Windows.","https://github.com/ProsecutorLadle/Tenorshare-ReiBoot-2026"
"LSS10-05-03/drive-sync-orchestrator",91,0,2026-06-15,"Google Drive Pro Unleashed 2026: Ultimate Cloud Sync & Automation Toolkit","https://github.com/LSS10-05-03/drive-sync-orchestrator"
"Enameltireclaim/Adobe-InDesign-2026",90,0,2026-06-18,"Adobe InDesign 2026 workflow — master pages, styles and print-ready PDF export on Windows.","https://github.com/Enameltireclaim/Adobe-InDesign-2026"
"aurelmarco/Mii-Crossing-N64-Studio",90,0,2026-06-15,"Animal Crossing New Horizons PC Emulation Suite 2026 – Mii Sharing & Switch 2 Port","https://github.com/aurelmarco/Mii-Crossing-N64-Studio"
"khalilannan1989-hue/cad-lisp-toolkit",90,0,2026-06-15,"New 3D CAD Architectural Plugin Suite 2026","https://github.com/khalilannan1989-hue/cad-lisp-toolkit"
"sparkassassinpush/iMazing-2026",90,0,2026-06-18,"iMazing workflow — encrypted iPhone backups, app export and restore verification on Windows.","https://github.com/sparkassassinpush/iMazing-2026"
"StephenDev0/StikPair",90,2,2026-06-18,"A simple SwiftUI iOS app that creates a pairing file on-device.","https://github.com/StephenDev0/StikPair"
"adityafahmi88/office-suite-vault",89,0,2026-06-15,"Best Microsoft Office 2026 Productivity Suite for Enterprise & Premium Users","https://github.com/adityafahmi88/office-suite-vault"
"KeeperDefine/ExitLag-2026",89,0,2026-06-18,"ExitLag workflow — route testing, game profiles, ping logs and network session notes for Windows gamers.","https://github.com/KeeperDefine/ExitLag-2026"
"Dobrejklucik/Steam-Perf-Insight-2026",89,0,2026-06-15,"🚀 Steam FPS Estimator 2026: Ultimate PC Gaming Performance Benchmark & Optimization Tool","https://github.com/Dobrejklucik/Steam-Perf-Insight-2026"
"FableItachi/gemini-desktop-forge",89,0,2026-06-15,"Gemini Vision Multi Platform AI Desktop App 2026","https://github.com/FableItachi/gemini-desktop-forge"
"affaan-m/ECC",218845,33557,2026-01-18,"The agent harness performance optimization system. Skills, instincts, memory, security, and research-first development for Claude Code, Codex, Opencode, Cursor and beyond.","https://github.com/affaan-m/ECC"
"ultraworkers/claw-code",194091,109934,2026-03-31,"An agent-managed museum exhibit, built in Rust with Gajae-Code / LazyCodex — developed and maintained with no human intervention.","https://github.com/ultraworkers/claw-code"
"multica-ai/andrej-karpathy-skills",179222,18328,2026-01-27,"A single CLAUDE.md file to improve Claude Code behavior, derived from Andrej Karpathy's observations on LLM coding pitfalls.","https://github.com/multica-ai/andrej-karpathy-skills"
"mattpocock/skills",138190,11991,2026-02-03,"Skills for Real Engineers. Straight from my .claude directory.","https://github.com/mattpocock/skills"
"garrytan/gstack",111930,16638,2026-03-11,"Use Garry Tan's exact Claude Code setup: 23 opinionated tools that serve as CEO, Designer, Eng Manager, Release Manager, Doc Engineer, and QA","https://github.com/garrytan/gstack"
"VoltAgent/awesome-design-md",91847,10903,2026-03-31,"A collection of DESIGN.md files analysis by popular brand design systems. Drop one into your project and let coding agents generate a matching UI.","https://github.com/VoltAgent/awesome-design-md"
"karpathy/autoresearch",87796,12704,2026-03-06,"AI agents running research on single-GPU nanochat training automatically","https://github.com/karpathy/autoresearch"
"JuliusBrussee/caveman",75149,4237,2026-04-04,"🪨 why use many token when few token do trick — Claude Code skill that cuts 65% of tokens by talking like caveman","https://github.com/JuliusBrussee/caveman"
"pewdiepie-archdaemon/odysseus",75060,9727,2026-05-31,"Self-hosted AI workspace. ","https://github.com/pewdiepie-archdaemon/odysseus"
"paperclipai/paperclip",71092,13221,2026-03-02,"The open-source app everyone uses to manage agents at work","https://github.com/paperclipai/paperclip"
"safishamsi/graphify",69910,7019,2026-04-03,"AI coding assistant skill (Claude Code, Codex, OpenCode, Cursor, Gemini CLI, and more). Turn any folder of code, SQL schemas, R scripts, shell scripts, docs, papers, images, or videos into a queryable knowledge graph. App code + database schema + infrastructure in one graph.","https://github.com/safishamsi/graphify"
