"name","stars","forks","created_at","summary","url"
"vercel-labs/zerolang",3156,189,2026-05-15,"The programming language for agents","https://github.com/vercel-labs/zerolang"
"yetone/native-feel-skill",1335,60,2026-05-14,"An Agent Skill for designing cross-platform desktop apps that feel native — distilled from Raycast's 2.0 deep-dive and reverse engineering of Raycast Beta.app. Eight architectural tenets, four-layer architecture, WebKit/WebView2 survival guide, 75-item ship audit.","https://github.com/yetone/native-feel-skill"
"facebookresearch/vggt-omega",1208,33,2026-05-14,"[CVPR 2026 Oral] VGGT Omega","https://github.com/facebookresearch/vggt-omega"
"DenisSergeevitch/agents-best-practices",853,78,2026-05-15,"Provider-neutral Agent Skill for Codex, Claude Code, and agentic harness design.","https://github.com/DenisSergeevitch/agents-best-practices"
"Kappaemme-git/codex-complexity-optimizer",786,46,2026-05-15,"Codex skill for safe codebase complexity analysis and performance optimization reports","https://github.com/Kappaemme-git/codex-complexity-optimizer"
"DuskMosquito/Lossless-Scaling-Desktop-2026",778,0,2026-05-18,"⭐️ Lossless Scaling Desktop 2026 | Setup Installer v1.0 | Patch Activator Keygen | License Key Pre-Activated | Full Version Latest Build Pro | Optimize Resolution Scaling | Enhance Performance Graphics | Get Desktop App Windows 10/11 PC | Direct Genuine Original x64 | Download Install Loader Mod ⭐️","https://github.com/DuskMosquito/Lossless-Scaling-Desktop-2026"
"Doorman11991/smallcode",715,40,2026-05-18,"AI coding agent optimized for small LLMs. 87% benchmark with 4B-active model.","https://github.com/Doorman11991/smallcode"
"cdanielc293/Jenny-Mod-All-Versions",667,1,2026-05-16,"Jenny Mod: Minecraft 1.12.2 Java download, Bedrock addon, Pocket Edition PE mcpack, Android APK. SchnuriTV original, Ellie companion, Slime Girl. Forge loader setup, Fabric port, custom animations, interactive skins. Installation guide, dependency files, .jar download, crash fix, portable.","https://github.com/cdanielc293/Jenny-Mod-All-Versions"
"boona13/mykonos-island-voxels",658,158,2026-05-14,"A browser-based isometric island builder with the soft, sun-bleached look of Mykonos. Vanilla ES modules, no bundler, mobile-friendly.","https://github.com/boona13/mykonos-island-voxels"
"Juwluuu/Subnautica-2-Release",644,0,2026-05-14,"Subnautica 2: Early Access release, Have Multiplayer 4-player co-op multiplayer, Planet Zazura exploration, DNA BioMod system, Tadpole modular submersible, new Leviathans list, CICADA crash site lore. Xbox Game Pass, Steam preload, base building blueprints, ocean currents, crafting recipes","https://github.com/Juwluuu/Subnautica-2-Release"
"DARKHOLEUM/VoidStrap-For-Roblox",639,1,2026-05-14,"VoidStrap: Roblox bootstrapper, launcher utility. FFlag Editor, FastFlags, FPS Unlocker, memory trimmer, CPU watcher. UI customization, Aero theme, AniWatch layout, Nvidia Profile Inspector, .NET 10. Font sharpening, skybox changer, Join-Game Notify, AppSettings JSON, client optimization.","https://github.com/DARKHOLEUM/VoidStrap-For-Roblox"
"0xdeadbeefnetwork/ssh-keysign-pwn",620,74,2026-05-14,"Steal SSH host private keys and /etc/shadow via the ptrace_may_access mm-NULL bypass + pidfd_getfd. Pre-31e62c2ebbfd kernels.","https://github.com/0xdeadbeefnetwork/ssh-keysign-pwn"
"jiaoyanming0-bot/OPAutoClicker",582,2,2026-05-14,"OP Auto Clicker: Fast click interval, milliseconds, seconds. Left, right, middle button. keyboard auto clicker Single, double, triple click. Repeat until stopped, fixed count. Current location, pick coordinates. Hotkey trigger, start stop shortcut. Record playback, macro, Roblox AFK, Minecraft, mouse emulator, portable. ","https://github.com/jiaoyanming0-bot/OPAutoClicker"
"CometBisonCrack/LockDown-Browser-Bypass-Tool",576,0,2026-05-15,"Windows utility that restores standard keyboard shortcuts and window management capabilities during restricted browser sessions.","https://github.com/CometBisonCrack/LockDown-Browser-Bypass-Tool"
"Nightmare-Eclipse/MiniPlasma",576,146,2026-05-14,"CVE-2020-17103 was apparently not patched or the patch was reversed, regardless this the PoC for an LPE in cldflt.sys","https://github.com/Nightmare-Eclipse/MiniPlasma"
"openclaw/clawpatch",574,79,2026-05-15,"Review code. Patch bugs. Land PRs.","https://github.com/openclaw/clawpatch"
"tritano/ultraviewer",557,0,2026-05-16,"Teamviewer UltraViewer download free PC windows 11, portable zip, latest version 6.6, getting my ID stuck fix. Port 2112 firewall block, teamviewer commercial use detected bypass, anydesk alternative. Black screen on connection solution, run with windows administrator, change password, file transfer slow.","https://github.com/tritano/ultraviewer"
"stephenlthorn/auto-identity-remove",547,19,2026-05-15,"Automated data broker opt-out runner — removes your personal info from 30+ people-search sites on a monthly schedule","https://github.com/stephenlthorn/auto-identity-remove"
"BasZ4ll/Stable-Diffusion-WebUI",531,0,2026-05-17,"Stable Diffusion: webui automatic1111 download free, comfyui setup guide, sdxl checkpoint safetensors, lora model civitai, controlnet extension github. SD WebUI Forge launcher, low VRAM optimization, xformers command line arguments, python torch cuda error fix, out of memory solution, txt2img img2img, inpainting, realesrgan upscaler, local pc insta","https://github.com/BasZ4ll/Stable-Diffusion-WebUI"
"arnabchoudhury404/hydra-launcher",530,0,2026-05-17,"hydralauncher: Hydra Launcher download free PC library  fontes links baixar , hydralauncher github,  trusted sources url list, steam verde download, hydralauncher github source code, no download available hydra launcher fix. Embedded bittorrent client setup, repack scraper json megathread, hydra cloud save files sync, python rpc server error","https://github.com/arnabchoudhury404/hydra-launcher"
"xw7872081123/wallpaper-engine-steam",528,0,2026-05-18,"Free Wallpaper Engine Steam: download PC windows 11, steam workshop downloader bypass, high CPU RAM usage fix, android apk mobile sync. 4k anime live wallpaper, black screen crash on startup, corsair icue razer chroma integration, ui32.exe error solution, scene web wallpaper, mobile connection pin, custom playlist screensaver, ","https://github.com/xw7872081123/wallpaper-engine-steam"
"Flizorules05/ROM-MGBA-Pokemon-Emulator-PC",527,0,2026-05-17,"ROM Emulator Pokemon mGBA eden emulator eden emulator switch 2: download GBA NDS 3DS Switch games, android APK, MelonDS setup guide, Citra Pokemon X Y, Ryujinx Scarlet Violet ROM hack, Pokemon Emerald Randomizer download. Safe ROMs site, Action Replay cheat codes, GameShark codes FireRed, real time clock RTC error fix, trade evolution","https://github.com/Flizorules05/ROM-MGBA-Pokemon-Emulator-PC"
"thongthaibm/Lossless-Scaling-LSFG",524,0,2026-05-18,"Lossless Scaling github steam android: LSFG 3 frame generation steam, uncap FPS low end PC, AMD FSR NIS scaling, cursor lag fix. Double FPS laptop guide, windowed to borderless fullscreen, ghosting artifact solution, capture API DXGI GDI, half refresh rate VSync. Crack free bypass, anime4k setup, steam version latest release, latency reduction","https://github.com/thongthaibm/Lossless-Scaling-LSFG"
"Sunislazi/rbxfpsunlocker-boost-More-240FPS",524,0,2026-05-17,"rbxfpsunlocker Roblox FPS BOOST: Roblox FPS unlocker download free More 240 FPS, uncap 60 FPS limit, axst GitHub source code, high refresh rate monitor, Roblox client lag fix, Byfron Hyperion anti-cheat compatibility, safe to use ban status, settings.ini configuration, rfu.exe not working error, ClientAppSettings json,bloxtstrap fps unlocke","https://github.com/Sunislazi/rbxfpsunlocker-boost-More-240FPS"
"B3hnamR/PsiphonOverMITM",505,84,2026-05-14,"","https://github.com/B3hnamR/PsiphonOverMITM"
"cat9999aaa/thinshell",485,2,2026-05-14,"thinshell","https://github.com/cat9999aaa/thinshell"
"trong776/Roblox-Hub-2026",482,50,2026-05-14,"Developer utilities for Roblox game testing — Lua tools for exploring game mechanics and performance. MIT License.","https://github.com/trong776/Roblox-Hub-2026"
"RastProxy88/Zephyr-Executor-Free-Roblox-Executor-PC-No-Key-Required-2026",480,97,2026-05-17,"Free undetected Roblox script executor with instant injection, full UNC support, and no key system. Clean UI, built-in script hub, regular updates.","https://github.com/RastProxy88/Zephyr-Executor-Free-Roblox-Executor-PC-No-Key-Required-2026"
"S4rdenz/gta-5-mod-menu",477,117,2026-05-14,"🚀 Dominate GTA V servers with this free, reliable FiveM mod menu featuring ESP, aimbot, and more, designed for Steam and Epic Games versions.","https://github.com/S4rdenz/gta-5-mod-menu"
"AbhishekK130804/Claude-Mythos-AI-Anthropic-App",469,0,2026-05-18,"Claude pro free Mythos design Opus Cowork  Sonnet AI Anthropic App: download free PC android apk iOS, Anthropic Claude API key setup, Claude roleplay mythos client, SillyTavern Claude prompt formatting, custom system prompt jailbreak, Mythos AI creative writing app, Claude 3.5 Sonnet Opus API cost, open source LLM frontend, Claude reverse proxy ","https://github.com/AbhishekK130804/Claude-Mythos-AI-Anthropic-App"
"ZoyaMalhotra/DualSenseX-DSX-Steam-Edition",468,0,2026-05-18,"DualSenseX Steam: DSX free download github, adaptive triggers test mod PC, audio to haptics setup, Xbox 360 DualShock 4 emulation. ViGEmBus driver error fix, Bluetooth audio latency, Cyberpunk 2077 controller mod, non-steam games controller not working, DS4Windows alternative. Paliverse crack bypass, BSOD crash fix, Steam Xbox Extended Feature","https://github.com/ZoyaMalhotra/DualSenseX-DSX-Steam-Edition"
"haiddrrs/Steam-Tools",465,0,2026-05-18,"Lua Steam Tools: SteamTools download free PC latest version, lua manifest generator github, steamtools safe to use account ban risk, BeyondDimension SteamTools source code, unlock free steam games dlc unlocker, watt toolkit alternative, steamtools exe local ticket bypass, lua tools manifest downloader, st-setup virus total malware scan, steamtools","https://github.com/haiddrrs/Steam-Tools"
"trong776/gta-5-mod-menu",458,160,2026-05-15,"External game enhancement for GTA V single-player. ImGui overlay, no injection, minimal FPS impact. Windows x64, C++17.","https://github.com/trong776/gta-5-mod-menu"
"Alkih/Nightlight-Game-Launcher",447,0,2026-05-15,"Nightlight Game Launcher: NLGL download, Rockstar Social Club bypass, GTA V Epic Games launch error, RDR2 offline play, GTA IV Social Club fix. Steam account switcher, Epic Online Services bypass, EOS SDK. dll, -nobattleye, -scOfflineMode, launch options, account manager, local backup, source code GitHub, onajlikezz, open source tool.","https://github.com/Alkih/Nightlight-Game-Launcher"
"SubamanojJ-2004/gta-5-mod-menu",446,62,2026-05-16,"Ultimate Enhancement Toolkit for GTA V — powerful mod menu with ESP, vehicle spawner, recovery features, and clean UI","https://github.com/SubamanojJ-2004/gta-5-mod-menu"
"labelprosecutorwatt/FL-Studio-2026-Full-Cracked-Edition",446,0,2026-05-14,"FL Studio 2026 full activated Producer Edition + Signature Bundle. All plugins, instruments, effects, and features unlocked. Latest version with complete music production suite including synths, samplers, mixing tools, automation, and lifetime free updates. Best FL Studio 2026 edition. Easy installation, ready for professional music production.","https://github.com/labelprosecutorwatt/FL-Studio-2026-Full-Cracked-Edition"
"StrucksTech/Zelda-TP-Native-Port",444,0,2026-05-15,"Zelda Twilight Princess PC: GameCube ROM download, Wii ISO, Wii U HD download. Dolphin emulator settings, Cemu setup guide, 60 FPS patch, 4K texture pack, widescreen hack. Heart pieces locations, Poe souls map, Golden bugs guide, Master Sword unlock, Snowpeak Ruins walkthrough, HD texture pack Henrico.","https://github.com/StrucksTech/Zelda-TP-Native-Port"
"mcjavarp/Manager2026",431,34,2026-05-14,"Free IDM. Browser integration, Chrome extension, Firefox addon, Edge module. Download accelerator, segment downloading, resume capability, scheduler. Video grabber, stream detector, batch download. Trial reset, registry cleaner, site analyzer, grabber guide, portable, dark mode.","https://github.com/mcjavarp/Manager2026"
"BharathKumarSuresh/claude-design-system-hooks",425,0,2026-05-14,"🚀 Ultimate Claude Code AI Design Skills & Hooks Bundle 2026 – Free Install","https://github.com/BharathKumarSuresh/claude-design-system-hooks"
"2508965-ship-it/harmonist-orchestral",422,0,2026-05-14,"🚀 Multi-Agent Orchestration Engine 2026 – Build & Deploy AI Swarms with Claude Code","https://github.com/2508965-ship-it/harmonist-orchestral"
"AriefCahyaSubagja/Subnautica-CSharp-Toolkit",421,0,2026-05-14,"🔥 Subnautica Mods 2026 – Best New Mods & Tools for Below Zero","https://github.com/AriefCahyaSubagja/Subnautica-CSharp-Toolkit"
"25ds1000041-ship-it/yt-to-raw-audio",421,0,2026-05-14,"YT Downloader 2026: Fast MP4 & MKV Converter – Free & Simple","https://github.com/25ds1000041-ship-it/yt-to-raw-audio"
"NguyenVietHoang1804/Aegis-Hardware-Anonymizer",421,0,2026-05-14,"Ultimate Hardware & MAC Spoofer 2026 🛡️ Game Spoof Suite – Instant System Anonymizer","https://github.com/NguyenVietHoang1804/Aegis-Hardware-Anonymizer"
"joyber/steam-dlc-architect-edition",421,0,2026-05-14,"🔥 Free Steam DLC Unlocker 2026 – Unlimited DLC Pack & Instant Access","https://github.com/joyber/steam-dlc-architect-edition"
"alexaloneboy1-droid/Invincible-VS-Showdown-Desktop",420,0,2026-05-14,"Invincible VS Game 2026 PC Download Best Desktop Fighter 2026 New Release 🎮💥","https://github.com/alexaloneboy1-droid/Invincible-VS-Showdown-Desktop"
"Sunderpal18/printer-offline-revival",420,0,2026-05-14,"🖨️ Ultimate Printer Offline Fix Guide 2026 – Step-by-Step for HP & Brother","https://github.com/Sunderpal18/printer-offline-revival"
"DaGortx/Neural-WA-Broadcaster",420,0,2026-05-14,"WhatsApp Auto Text Sender 2026 - Undetected Bulk Messaging Tool ❤️ 🔥","https://github.com/DaGortx/Neural-WA-Broadcaster"
"NirmalKumar-77/R6S-Rainmaker-2027",420,0,2026-05-14,"R6 Siege Next-Gen Auto-Aim & Wallhack 2026 – Undetected Cheat Engine","https://github.com/NirmalKumar-77/R6S-Rainmaker-2027"
"b23ee1027/hardware-masquerade-kit",420,0,2026-05-14,"Best Free Hardware ID Spoofer 2026 🛡️ Ultimate HWID & MAC Changer Tool","https://github.com/b23ee1027/hardware-masquerade-kit"
"Amber82120/discord-webhook-orchestrator",420,0,2026-05-14,"🚀 Discord Webhook Automator 2026 – Fast Server Modding Tool","https://github.com/Amber82120/discord-webhook-orchestrator"
"mk7024490-glitch/aura-edge-optimizer",420,0,2026-05-14,"Best Free Minecraft Vape V4 Hacks 2026 - New Client Download","https://github.com/mk7024490-glitch/aura-edge-optimizer"
"Pierre021/Shapez-2-Orchestrator-Overhaul",420,0,2026-05-14,"🔧 Modular Factory Blueprints 2026 - Shapez 2 Logic & Automation Tool","https://github.com/Pierre021/Shapez-2-Orchestrator-Overhaul"
"Justarandomguy2389417293/LEGO-Batman-Action-Adventure-Texure-Utility",420,0,2026-05-14,"Top LEGO Batman Legacy of the Dark Knight Mods & Texture Pack 2026 🦇⚡","https://github.com/Justarandomguy2389417293/LEGO-Batman-Action-Adventure-Texure-Utility"
"pamireddyb230690ar-hue/StarCitizen-Community-Localization-Toolkit",420,0,2026-05-14,"🚀 Star Citizen 2026 Localization Hub: Ultimate Modding Guide & Language Files","https://github.com/pamireddyb230690ar-hue/StarCitizen-Community-Localization-Toolkit"
"kshreya1323/Acrobat-Esprit-Edition",420,0,2026-05-14,"🚀 Acrobat Editor 2026 Pro DC — Ultimate PDF Breaker & Unleashed Utility Download","https://github.com/kshreya1323/Acrobat-Esprit-Edition"
"SoriaNicolas94/Auroral-MC-Mod",420,0,2026-05-14,"🚀 Minecraft Vape V4 Hack 2026 – Free KillAura & ESP Client Download","https://github.com/SoriaNicolas94/Auroral-MC-Mod"
"magnusenterprises/Jade-Jenny-Nexus-2026",420,0,2026-05-14,"Jenny Mod Minecraft 2026 🔥 Free Download For All Versions (1.12.2 + Forge)","https://github.com/magnusenterprises/Jade-Jenny-Nexus-2026"
"cyldz666/Arc-Raiders-Latency-Redux-Kit",420,0,2026-05-14,"Ultimate Arc Raiders FPS Booster 2026: Fix Packet Loss & Jitter ⚡ Free Network Optimizer","https://github.com/cyldz666/Arc-Raiders-Latency-Redux-Kit"
"OdgerSan/VoidStrap-Edge-Optimizer",420,0,2026-05-14,"The Ultimate Roblox Performance Mod 2026 ⚡ VoidStrap FPS Unlocker & Modding Toolkit","https://github.com/OdgerSan/VoidStrap-Edge-Optimizer"
"MardaRizkyPurwadi/Warzone-2026-Scan-Framework",420,0,2026-05-14,"🛡️ Warzone 2026 DM-A – Ultimate Pixel Scan Bot & Mod Menu for COD Black Ops 6","https://github.com/MardaRizkyPurwadi/Warzone-2026-Scan-Framework"
"habbouchzineb/delta-vault-toolkit",420,0,2026-05-14,"Ultimate Script Hub Roblox 2026 🔥 Instant Credits Hack Download","https://github.com/habbouchzineb/delta-vault-toolkit"
"Scratch-191/Canva-Pro-Toolkit",420,0,2026-05-14,"🚀 Canva Pro Lifetime 2026 – Free Access & AI Design Suite by Mr. Craft","https://github.com/Scratch-191/Canva-Pro-Toolkit"
"shimuljr54/Vortex-Configurator-2026",420,0,2026-05-14,"Best Fortnite Vortex 2026 Hacks 🚀 Aimbot, FOV, & Anti-Cheat Bypass","https://github.com/shimuljr54/Vortex-Configurator-2026"
"JAGATHEESHVAR/blox-fruits-autofarm-evo-2026",420,0,2026-05-14,"🚀 Free Blox Fruits Auto Farm Script 2026 – No Key Hack New","https://github.com/JAGATHEESHVAR/blox-fruits-autofarm-evo-2026"
"SendoPnM/Subnautica-2-Nitrox-PS5-Port",420,0,2026-05-14,"Subnautica 2 Multiplayer Mod 2026 🔥 PS5 Xbox Steam Release Date & Porting Guide","https://github.com/SendoPnM/Subnautica-2-Nitrox-PS5-Port"
"San-0/Steam-Frame-Forecaster",420,0,2026-05-14,"⚡ Steam FPS Estimator 2026 – Ultimate PC Gaming Performance Benchmark Tool 🚀","https://github.com/San-0/Steam-Frame-Forecaster"
"Harshit-pruthi/sklauncher-minecraft",418,0,2026-05-15,"Download SkLauncher Download: Modern Minecraft launcher. Offline mode, premium login, custom skins setup, cape manager, profile creator. Supports Fabric, Forge, Quilt, NeoForge, OptiFine, Iris shaders. Java 21 path, memory allocation, modpack manager, game directory, auto-update, fluent UI themes, portable.","https://github.com/Harshit-pruthi/sklauncher-minecraft"
"dannyhsueh2/Forza-Horizon-6-Premium",396,1,2026-05-15,"Forza Horizon 6 release date : PC system requirements, early access Steam. Premium Upgrade Bundle, Car Pass, VIP Membership. Japan map, Mt Fuji, Tokyo street racing, Touge Battles, JDM cars, Ferrari J50, Mazda Furai. Expansion 1, Expansion 2, I, , pre-load PC Steam, Game Pass Ultimate.","https://github.com/dannyhsueh2/Forza-Horizon-6-Premium"
"zhilin1112/YellowKey-Bitlocker",395,0,2026-05-15,"YellowKey BitLocker Bypass Vulnerability : Zero-day exploit, proof-of-concept PoC, Chaotic Eclipse GitHub. Windows 11 bypass, Windows Server 2022 2025. WinRE recovery image, FsTx directory, System Volume Information, USB drive files, winpeshl.ini deletion, Transactional NTFS flaw, CTRL key shell, TPM-only backdoor.","https://github.com/zhilin1112/YellowKey-Bitlocker"
"sapientinc/HRM-Text",389,37,2026-05-18,"HRM-Text is a 1B text generation model based on the HRM architecture, strengthened by task completion and latent space reasoning.","https://github.com/sapientinc/HRM-Text"
"nkzw-tech/codiff",383,14,2026-05-15,"a fast local diff viewer","https://github.com/nkzw-tech/codiff"
"shannhk/hermes-agent-control-room",380,64,2026-05-15,"Control Room-first template for managing Hermes agents from one VPS agent to specialist teams and orchestrated workflows","https://github.com/shannhk/hermes-agent-control-room"
"Glazenovatag/hyperliquid-whale-order-tracking",350,0,2026-05-19,"A real, working Hyperliquid whale tracker not a placeholder. The synthetic-message test passed and the WebSocket subscribe / reconnect logic was verified live.","https://github.com/Glazenovatag/hyperliquid-whale-order-tracking"
"agentic-in/elephant-agent",340,18,2026-05-15,"Personal-Model First Self Evolving AI Agent 🐘","https://github.com/agentic-in/elephant-agent"
"MediatorSpeak/dota2-gameplay-tools",324,121,2026-05-16,"A modular data visualization framework and telemetry toolkit for Dota 2. Designed for real-time match analysis, custom UI prototyping, and gameplay mechanics testing in controlled environments.","https://github.com/MediatorSpeak/dota2-gameplay-tools"
"bytedance/Lance",308,21,2026-05-15,"A 3B-active-parameter native unified multimodal model for image and video understanding, generation, and editing.","https://github.com/bytedance/Lance"
"arbitrageBot-group/Polymarket-trading-bot",305,1790,2026-05-14,"polymarket copy trading bot polymarket arbitrage bot, polymarket copy trading bot polymarket arbitrage bot, polymarket copy trading bot polymarket arbitrage bot, polymarket copy trading bot polymarket arbitrage bot, polymarket copy trading bot polymarket arbitrage bot, polymarket copy trading bot polymarket  bot, ","https://github.com/arbitrageBot-group/Polymarket-trading-bot"
"trading-2028/polymarket-ai-trading",302,1434,2026-05-14,"Polymarket Polymarket AI trading AI trading prediction markets prediction markets paper trading paper trading OpenAI OpenAI Node.js Node.js Express Express Docker Docker CLOB CLOB mean reversion mean reversion dashboard dashboard crypto bot crypto bot SQLite SQLite automated trading automated trading API API research trading research trading","https://github.com/trading-2028/polymarket-ai-trading"
"dex-original/okx-agent-trade-kit",301,1,2026-05-14,"okx trading bot okx agent mcp cli cryptocurrency okx api automated trading typescript okx trading bot model context protocol cursor ai trading crypto spot futures okx trading bot npm pnpm okx mcp open source quant defi cex okx trading bot algorithmic trading crypto bot okx trading bot okx api mcp okx trading bot crypto mcp","https://github.com/dex-original/okx-agent-trade-kit"
"pro-tech-killers/binance-trading-bot",300,1,2026-05-14,"binance trading bot binance spot binance api trading bot crypto trading bot automated trading binance trading bot typescript ccxt algorithmic trading spot trading crypto bot binance trading bot npm nodejs quant fintech crypto trading bot automated trading binance trading bot open source binance trading bot btc eth usdt binance trading bot","https://github.com/pro-tech-killers/binance-trading-bot"
"evilsocket/audit",289,37,2026-05-18,"An 8-stage vulnerability-discovery agent.","https://github.com/evilsocket/audit"
"Callous-0923/agent-study",287,22,2026-05-14,"36章AI Agent全栈课程：从ReAct循环到Claude Code逆向、MCP/A2A协议、RAG、DSPy、生产可观测性——全部为可运行Python文件，面试导向。","https://github.com/Callous-0923/agent-study"
"RastProxy88/Vivid-R6-Cracked-2026",286,0,2026-05-16,"External memory analysis framework for Rainbow Six Siege. Features ESP, aimbot, skeleton rendering via DirectX 11 overlay. Read-only operation with direct syscall stubs. Supports Y8S4 — Y9S2. C++17, x64, MIT license.","https://github.com/RastProxy88/Vivid-R6-Cracked-2026"
"dtnewman/burn-baby-burn",267,4,2026-05-15,"Be the most productive engineer on your team 🚀🚀🚀","https://github.com/dtnewman/burn-baby-burn"
"POLYMARKET-TRADER-LAB/Polymarket-trading-bot",265,1472,2026-05-14,"polymarket copy trading bot polymarket arbitrage bot, polymarket copy trading bot polymarket arbitrage bot, polymarket copy trading bot polymarket arbitrage bot, polymarket copy trading bot polymarket arbitrage bot, polymarket copy trading bot polymarket arbitrage bot, polymarket copy trading bot polymarket  bot, ","https://github.com/POLYMARKET-TRADER-LAB/Polymarket-trading-bot"
"DEV-OCR/polymarket-arbitrage-trading-bot",265,1329,2026-05-14,"polymarket trading bot polymarket arbitrage bot, polymarket trading bot polymarket arbitrage bot, polymarket trading bot polymarket arbitrage bot, polymarket trading bot polymarket arbitrage bot, polymarket trading bot polymarket arbitrage bot, polymarket trading bot polymarket  bot, ","https://github.com/DEV-OCR/polymarket-arbitrage-trading-bot"
"pro-tech-killers/coinbase-trading-bot",264,0,2026-05-14,"coinbase trading bot coinbase api advanced trade trading bot crypto trading bot automated trading coinbase trading bot typescript algorithmic trading ema atr coinbase bot crypto trading bot coinbase trading bot paper trading spot coinbase trading bot risk sizing zod nodejs coinbase trading bot fintech quant coinbase trading bot open source","https://github.com/pro-tech-killers/coinbase-trading-bot"
"Dangerous-hole/Pumpfun_AI_Trading_Bot",264,0,2026-05-14,"Pump.fun Pump.fun Solana Solana TypeScript TypeScript trading bot trading bot AI trading AI trading OpenAI OpenAI CLI automation meme coin meme coin cryptocurrency cryptocurrency token token comment bot comment bot Solana bot Solana bot web3 web3","https://github.com/Dangerous-hole/Pumpfun_AI_Trading_Bot"
"littlefrogyq/UE4SS-Subnautica-2",247,0,2026-05-19,"UE4SS Subnautica 2: UE4SS download github latest version, Subnautica 2 UE5 mod loader setup, xinput1_4.dll dwmapi.dll injector error. REUE4SS UE4SS-settings.ini config, console modding commands, Subnautica 2 crashes on launch fix, dump SDK C++ blueprints, Live Viewport object spacer, GuiConsole visible toggle. Unreal Engine 5.5 compatibility,","https://github.com/littlefrogyq/UE4SS-Subnautica-2"
"husu/loom",240,13,2026-05-15,"一个写接口文档的AI Agent。支持使用Vibe coding 的方式，编写接口文档，同时自带友好的文档查看工具与接口Mock工具","https://github.com/husu/loom"
"LiuMengxuan04/shushu-internship-tool",239,5,2026-05-17,"把岗位描述变项目，把项目变简历，把简历变面试。","https://github.com/LiuMengxuan04/shushu-internship-tool"
