"name","stars","forks","created_at","summary","url"
"Leey21/awesome-ai-research-writing",31230,2356,2026-01-30,"Elevate your AI research writing, no more tedious polishing ✨ ","https://github.com/Leey21/awesome-ai-research-writing"
"DeusData/codebase-memory-mcp",30599,2452,2026-02-24,"High-performance code intelligence MCP server. Indexes codebases into a persistent knowledge graph — average repo in milliseconds. 158 languages, sub-ms queries, 99% fewer tokens. Single static binary, zero dependencies.","https://github.com/DeusData/codebase-memory-mcp"
"nanocoai/nanoclaw",30213,12884,2026-01-31,"A lightweight alternative to OpenClaw that runs in containers for security. Connects to WhatsApp, Telegram, Slack, Discord, Gmail and other messaging apps,, has memory, scheduled jobs, and runs directly on Anthropic's Agents SDK","https://github.com/nanocoai/nanoclaw"
"sipeed/picoclaw",29727,4440,2026-02-04,"Tiny, Fast, and Deployable anywhere — automate the mundane, unleash your creativity","https://github.com/sipeed/picoclaw"
"googleworkspace/cli",29636,1720,2026-03-02,"Google Workspace CLI — one command-line tool for Drive, Gmail, Calendar, Sheets, Docs, Chat, Admin, and more. Dynamically built from Google Discovery Service. Includes AI agent skills.","https://github.com/googleworkspace/cli"
"AlexsJones/llmfit",29320,1789,2026-02-15,"Hundreds of models & providers. One command to find what runs on your hardware.","https://github.com/AlexsJones/llmfit"
"blader/humanizer",28879,2673,2026-01-18,"Claude Code skill that removes signs of AI-generated writing from text","https://github.com/blader/humanizer"
"CloakHQ/CloakBrowser",28122,2257,2026-02-22,"Stealth Chromium that passes every bot detection test. Drop-in Playwright replacement with source-level fingerprint patches. 30/30 tests passed.","https://github.com/CloakHQ/CloakBrowser"
"openai/codex-plugin-cc",28046,1835,2026-03-30,"Use Codex from Claude Code to review code or delegate tasks.","https://github.com/openai/codex-plugin-cc"
"Yuan1z0825/nature-skills",28019,1692,2026-04-24,"符合nature论文学术表达和科研绘图的Skill","https://github.com/Yuan1z0825/nature-skills"
"alchaincyf/nuwa-skill",27605,3917,2026-04-05,"你想蒸馏的下一个员工，何必是同事。蒸馏任何人的思维方式——心智模型、决策启发式、表达DNA。Distill how anyone thinks.","https://github.com/alchaincyf/nuwa-skill"
"esengine/DeepSeek-Reasonix",26752,1678,2026-04-21,"DeepSeek-native AI coding agent for your terminal. Engineered around prefix-cache stability — leave it running.","https://github.com/esengine/DeepSeek-Reasonix"
"jackwener/OpenCLI",26538,2610,2026-03-14,"Make Any Website into CLI & Use your logged-in browser by AI agent. ","https://github.com/jackwener/OpenCLI"
"xai-org/x-algorithm",26422,4530,2026-01-19,"Algorithm powering the For You feed on X","https://github.com/xai-org/x-algorithm"
"openai/symphony",25926,2625,2026-02-26,"Symphony turns project work into isolated, autonomous implementation runs, allowing teams to manage work instead of supervising coding agents.","https://github.com/openai/symphony"
"google-labs-code/design.md",25770,2163,2026-04-10,"A format specification for describing a visual identity to coding agents. DESIGN.md gives agents a persistent, structured understanding of a design system.","https://github.com/google-labs-code/design.md"
"mukul975/Anthropic-Cybersecurity-Skills",25402,3081,2026-02-25,"817 structured cybersecurity skills for AI agents · Mapped to 6 frameworks: MITRE ATT&CK, NIST CSF 2.0, MITRE ATLAS, D3FEND, NIST AI RMF & MITRE F3 (Fight Fraud) · agentskills.io standard · Works with Claude Code, GitHub Copilot, Codex CLI, Cursor, Gemini CLI & 20+ platforms · 29 security domains · Apache 2.0","https://github.com/mukul975/Anthropic-Cybersecurity-Skills"
"rohitg00/agentmemory",25045,2075,2026-02-25,"#1 Persistent memory for AI coding agents based on real-world benchmarks","https://github.com/rohitg00/agentmemory"
"BigPizzaV3/CodexPlusPlus",24804,1581,2026-05-06,"An enhanced tool for CodexApp, striving to make Codex better to use and more comfortable 一个CodexApp的增强工具，努力让Codex变得更好用更舒服","https://github.com/BigPizzaV3/CodexPlusPlus"
"manaflow-ai/cmux",24326,1957,2026-01-28,"Open source Ghostty-based macOS terminal with vertical tabs and notifications for AI coding agents. Built for multitasking, organization, and programmability.","https://github.com/manaflow-ai/cmux"
"phuryn/pm-skills",23556,2501,2026-03-01,"PM Skills Marketplace: 100+ agentic skills, commands, and plugins — from discovery to strategy, execution, launch, and growth.","https://github.com/phuryn/pm-skills"
"Donchitos/Claude-Code-Game-Studios",22901,3286,2026-02-12,"Turn Claude Code into a full game dev studio — 49 AI agents, 72 workflow skills, and a complete coordination system mirroring real studio hierarchy.","https://github.com/Donchitos/Claude-Code-Game-Studios"
"NawfalMotii79/PLFM_RADAR",22643,5286,2026-03-08,"Open-source, low-cost 10.5 GHz PLFM phased array RADAR system","https://github.com/NawfalMotii79/PLFM_RADAR"
"anthropics/knowledge-work-plugins",22554,2651,2026-01-23,"Open source repository of plugins primarily intended for knowledge workers to use in Claude Cowork","https://github.com/anthropics/knowledge-work-plugins"
"NVIDIA/NemoClaw",21754,2939,2026-03-15,"Run agents like Hermes, LangChain Deep Agents, and OpenClaw more securely inside NVIDIA OpenShell with managed inference","https://github.com/NVIDIA/NemoClaw"
"MadsLorentzen/ai-job-search",21428,6374,2026-03-18,"The job search that runs on your machine. AI job application framework built on Claude Code: evaluate postings, tailor CVs, write cover letters, prep interviews. Fork it and own it.","https://github.com/MadsLorentzen/ai-job-search"
"alchaincyf/huashu-design",21306,2537,2026-04-19,"Huashu Design · HTML-native design skill for Claude Code · Claude Code 里 HTML 原生的设计 skill · 高保真原型 / 幻灯片 / 动画 + 20 设计哲学 + 5 维评审 + MP4 导出 · Agent-agnostic","https://github.com/alchaincyf/huashu-design"
"claude-code-best/claude-code",21123,16398,2026-03-31,"原汁原昧 Claude Code 可运行,可构建, 可调试版; 生产级工程化, 企业级可靠性; 安全无毒, 内存泄露修复","https://github.com/claude-code-best/claude-code"
"op7418/guizang-ppt-skill",21076,1505,2026-04-23,"AI-agent Skill for generating polished HTML slide decks: editorial magazine and Swiss layouts, image prompts, social covers, and a WebGL/low-power presentation runtime.","https://github.com/op7418/guizang-ppt-skill"
"HKUDS/Vibe-Trading",20520,3594,2026-04-01,"""Vibe-Trading: Your Personal Trading Agent""","https://github.com/HKUDS/Vibe-Trading"
"titanwings/colleague-skill",20220,1994,2026-03-30,"将冰冷的离别化为温暖的 Skill，欢迎加入数字生命1.0！Transforming cold farewells into warm skills? It's giving rebirth era. Welcome to Digital Life 1.0. 🫶","https://github.com/titanwings/colleague-skill"
"THU-MAIC/OpenMAIC",19594,3849,2026-03-11,"Open Multi-Agent Interactive Classroom — Get an immersive, multi-agent learning experience in just one click","https://github.com/THU-MAIC/OpenMAIC"
"tirth8205/code-review-graph",19462,2080,2026-02-26,"Local-first code intelligence graph for MCP and CLI. Builds a persistent map of your codebase so AI coding tools read only what matters, with benchmarked context reductions on reviews and large-repo workflows.","https://github.com/tirth8205/code-review-graph"
"webadderallorg/Recordly",19004,1371,2026-03-12,"Create polished demo videos without editing skills. Mac/Windows/Linux","https://github.com/webadderallorg/Recordly"
"h4ckf0r0day/obscura",18950,1352,2026-04-13,"The headless browser for AI agents and web scraping","https://github.com/h4ckf0r0day/obscura"
"mksglu/context-mode",18846,1324,2026-02-23,"Context window optimization for AI coding agents. Sandboxes tool output (98% reduction), persists session memory, and   enforces routing across 17 platforms via MCP + hooks.","https://github.com/mksglu/context-mode"
"tanweai/pua",18767,1130,2026-03-08,"你是一个曾经被寄予厚望的 P8 级工程师。Anthropic 当初给你定级的时候，对你的期望是很高的。  一个agent使用的高能动性的skill。  Your AI has been placed on a PIP. 30 days to show improvement.","https://github.com/tanweai/pua"
"antirez/ds4",18336,1583,2026-05-06,"DeepSeek 4 Flash and PRO local inference engine for Metal, CUDA and ROCm","https://github.com/antirez/ds4"
"RightNow-AI/openfang",18001,2279,2026-02-24,"Open-source Agent Operating System","https://github.com/RightNow-AI/openfang"
"jundot/omlx",17778,1507,2026-02-13,"LLM inference server with continuous batching & SSD caching for Apple Silicon — managed from the macOS menu bar","https://github.com/jundot/omlx"
"jnMetaCode/agency-agents-zh",17169,2922,2026-03-06,"🎭 266 个即插即用的 AI 专家角色 — 支持 Hermes Agent/Claude Code/Cursor/Copilot 等 18 种工具，覆盖工程/设计/营销/金融等 20 个部门。含 50 个中国市场原创智能体（小红书/抖音/微信/飞书/钉钉等）。搭配编排器 agency-orchestrator，一句话即可让多位专家按 DAG 自动协作。","https://github.com/jnMetaCode/agency-agents-zh"
"KKKKhazix/khazix-skills",16911,1952,2026-04-06,"数字生命卡兹克开源的 AI Skills 合集","https://github.com/KKKKhazix/khazix-skills"
"different-ai/openwork",16823,1722,2026-01-14,"An open-source alternative to Claude Cowork (powered by opencode)","https://github.com/different-ai/openwork"
"floci-io/floci",16418,1626,2026-02-18,"Light, fluffy, and always free - The AWS Local Emulator alternative","https://github.com/floci-io/floci"
"diegosouzapw/OmniRoute",16198,2475,2026-02-13,"Never stop coding. Free AI gateway: one endpoint, 231+ providers (50+ free), connect Claude Code, Codex, Cursor, Cline & Copilot to FREE Claude/GPT/Gemini. RTK+Caveman stacked compression saves 15-95% tokens, smart auto-fallback, MCP/A2A, multimodal APIs, Desktop/PWA.","https://github.com/diegosouzapw/OmniRoute"
"cft0808/edict",16185,1702,2026-02-23,"🏛️ 三省六部制 · OpenClaw Multi-Agent Orchestration System — 9 specialized AI agents with real-time dashboard, model config, and full audit trails","https://github.com/cft0808/edict"
"nesquena/hermes-webui",15936,2114,2026-03-30,"Hermes WebUI: The best way to use Hermes Agent from the web or from your phone!","https://github.com/nesquena/hermes-webui"
"tashfeenahmed/freellmapi",15915,2318,2026-04-21,"OpenAI-compatible proxy that stacks the free tiers of 16 LLM providers (~1.7B tokens/month) behind one /v1 endpoint — plus any custom OpenAI-compatible endpoint. Smart routing, automatic failover, encrypted keys. Personal experimentation only.","https://github.com/tashfeenahmed/freellmapi"
"vercel-labs/json-render",15674,845,2026-01-14,"The Generative UI framework","https://github.com/vercel-labs/json-render"
"larksuite/cli",15507,1223,2026-03-25,"The official Lark/Feishu CLI tool, maintained by the larksuite team — built for humans and AI Agents. Covers core business domains including Messenger, Docs, Base, Sheets, Calendar, Mail, Tasks, Meetings, and more, with 200+ commands and 20+ AI Agent Skills.","https://github.com/larksuite/cli"
"iOfficeAI/OfficeCLI",15411,1051,2026-03-15,"OfficeCLI is the first and best Office suite  purpose-built for AI agents to read, edit, and automate Word, Excel, and PowerPoint files. Free, open-source, single binary, no Office installation required.","https://github.com/iOfficeAI/OfficeCLI"
"HKUDS/OpenHarness",14738,2400,2026-04-01,"""OpenHarness: Open Agent Harness with a Built-in Personal Agent--Ohmo!""","https://github.com/HKUDS/OpenHarness"
"microsoft/RustTraining",14703,1152,2026-03-13,"Beginner, advanced, expert level Rust training material","https://github.com/microsoft/RustTraining"
"kyegomez/OpenMythos",14668,3298,2026-04-18,"A theoretical reconstruction of the Claude Mythos architecture, built from first principles using the available research literature.","https://github.com/kyegomez/OpenMythos"
"nashsu/llm_wiki",14370,1718,2026-04-08,"LLM Wiki is a cross-platform desktop application that turns your documents into an organized, interlinked knowledge base — automatically. Instead of traditional RAG (retrieve-and-answer from scratch every time), the LLM incrementally builds and maintains a persistent wiki from your sources。","https://github.com/nashsu/llm_wiki"
"nikopueringer/CorridorKey",14353,875,2026-02-25,"Perfect Green Screen Keys","https://github.com/nikopueringer/CorridorKey"
"chenhg5/cc-connect",13867,1317,2026-02-28,"Bridge local AI coding agents (Claude Code, Cursor, Gemini CLI, Codex) to messaging platforms (Feishu/Lark, DingTalk, Slack, Telegram, Discord, LINE, WeChat Work). Chat with your AI dev assistant from anywhere — no public IP required for most platforms.","https://github.com/chenhg5/cc-connect"
"pingdotgg/t3code",13738,2889,2026-02-08,"","https://github.com/pingdotgg/t3code"
"lsdefine/GenericAgent",13374,1540,2026-01-16,"Self-evolving agent: grows skill tree from 3.3K-line seed, achieving full system control with 6x less token consumption","https://github.com/lsdefine/GenericAgent"
"NanmiCoder/cc-haha",13319,8433,2026-03-31,"Claude Code 泄露源码 - 本地可运行版本，新增跨平台桌面端软件补齐Computer Use（附带核心模块解析）","https://github.com/NanmiCoder/cc-haha"
"wanshuiyin/Auto-claude-code-research-in-sleep",13314,1201,2026-03-10,"ARIS ⚔️ (Auto-Research-In-Sleep) — Lightweight Markdown-only skills for autonomous ML research: cross-model review loops, idea discovery, and experiment automation. No framework, no lock-in — works with Claude Code, Codex, OpenClaw, or any LLM agent.","https://github.com/wanshuiyin/Auto-claude-code-research-in-sleep"
"fathah/hermes-desktop",13280,1509,2026-04-02,"Desktop Companion for Hermes Agent","https://github.com/fathah/hermes-desktop"
"waooAI/waoowaoo",13199,2945,2026-01-22,"首家工业级全流程 AI 影视生产平台。Industry-first professional AI Agent platform for controllable film & video production. From shorts to live-action with Hollywood-standard workflows.","https://github.com/waooAI/waoowaoo"
"jlcodes99/cockpit-tools",13194,1215,2026-01-16," 🚀 通用 AI IDE 账号管理工具：支持 Antigravity / Codex / GitHub Copilot / Windsurf / Kiro / Cursor / Gemini-cli / CodeBuddy，多账号切换、配额监控、自动唤醒与多开实例管理。 🚀 Universal AI IDE account manager for Antigravity / Codex / GitHub Copilot / Windsurf / Kiro / Cursor / Gemini-cli / CodeBuddy, with multi-account switching, quota monitoring, wake-up automation, and multi-insta","https://github.com/jlcodes99/cockpit-tools"
"op7418/Humanizer-zh",13009,911,2026-01-19,"Humanizer 的汉化版本，Claude Code Skills，旨在消除文本中 AI 生成的痕迹。","https://github.com/op7418/Humanizer-zh"
"xbtlin/ai-berkshire",12892,1845,2026-04-07,"AI 时代的伯克希尔：基于 Claude Code / Codex 的价值投资研究框架。巴菲特·芒格·段永平·李录四大师方法论 + 多Agent并行研究。| AI-era Berkshire: a value investing research framework built for Claude Code / Codex. 4 masters' methodologies + multi-agent adversarial analysis.","https://github.com/xbtlin/ai-berkshire"
"RyanCodrai/turbovec",12666,1120,2026-03-26,"A vector index built on TurboQuant, written in Rust with Python bindings","https://github.com/RyanCodrai/turbovec"
"nearai/ironclaw",12518,1467,2026-02-03,"IronClaw is an Agent OS focused on privacy, security and extensibility","https://github.com/nearai/ironclaw"
"QwenLM/Qwen3-TTS",12383,1599,2026-01-21,"Qwen3-TTS is an open-source series of TTS models developed by the Qwen team at Alibaba Cloud, supporting stable, expressive, and streaming speech generation, free-form voice design, and vivid voice cloning.","https://github.com/QwenLM/Qwen3-TTS"
"re4/LibreCode",497067,2,2026-04-10,"LibreCode - A Ollama cursor like coding / Reversing Interface","https://github.com/re4/LibreCode"
"obra/superpowers",253014,22599,2025-10-09,"An agentic skills framework & software development methodology that works.","https://github.com/obra/superpowers"
"NousResearch/hermes-agent",213728,39624,2025-07-22,"The agent that grows with you","https://github.com/NousResearch/hermes-agent"
"github/spec-kit",119978,10651,2025-08-21,"💫 Toolkit to help you get started with Spec-Driven Development","https://github.com/github/spec-kit"
"earendil-works/pi",69924,8617,2025-08-09,"AI agent toolkit: unified LLM API, agent loop, TUI, coding agent CLI","https://github.com/earendil-works/pi"
"ComposioHQ/awesome-claude-skills",67538,7617,2025-10-17,"A curated list of awesome Claude Skills, resources, and tools for customizing Claude AI workflows","https://github.com/ComposioHQ/awesome-claude-skills"
"datawhalechina/hello-agents",65642,8132,2025-09-07,"📚 《从零开始构建智能体》——从零开始的智能体原理与实践教程","https://github.com/datawhalechina/hello-agents"
"shanraisshan/claude-code-best-practice",62485,6249,2025-10-31,"from vibe coding to agentic engineering - practice makes claude perfect","https://github.com/shanraisshan/claude-code-best-practice"
"Fission-AI/OpenSpec",60338,4189,2025-08-05,"Spec-driven development (SDD) for AI coding assistants.","https://github.com/Fission-AI/OpenSpec"
"tw93/Mole",58748,2073,2025-09-23,"🐹 Clean, uninstall, analyze, optimize, and monitor your Mac from the terminal.","https://github.com/tw93/Mole"
"headroomlabs-ai/headroom",58740,4342,2026-01-07,"Compress tool outputs, logs, files, and RAG chunks before they reach the LLM. 60-95% fewer tokens, same answers. Library, proxy, MCP server.","https://github.com/headroomlabs-ai/headroom"
"ChromeDevTools/chrome-devtools-mcp",46765,3201,2025-09-11,"Chrome DevTools for coding agents","https://github.com/ChromeDevTools/chrome-devtools-mcp"
"KeygraphHQ/shannon",45623,5294,2025-09-27,"Shannon is an autonomous, white-box AI pentester for web applications and APIs. It analyzes your source code, identifies attack vectors, and executes real exploits to prove vulnerabilities before they reach production.","https://github.com/KeygraphHQ/shannon"
"abhigyanpatwari/GitNexus",44024,4902,2025-08-02,"GitNexus: The Zero-Server Code Intelligence Engine -       GitNexus is a client-side knowledge graph creator that runs entirely in your browser. Drop in a git repository (Github, Gitlab, Azure, Local) or ZIP file, and get an interactive knowledge graph with a built in Graph RAG Agent. Perfect for code exploration","https://github.com/abhigyanpatwari/GitNexus"
"kepano/obsidian-skills",41383,2945,2026-01-02,"Agent skills for Obsidian. Teach your agent to use Obsidian CLI and open formats including Markdown, Bases, JSON Canvas.","https://github.com/kepano/obsidian-skills"
"hugohe3/ppt-master",38545,3207,2025-12-10,"AI generates a real, editable PowerPoint from any document — native shapes & animations, editable charts & tables you can change the data on, speaker notes voiced as audio narration, and the option to follow your own .pptx template, not slide images · by Hugo He","https://github.com/hugohe3/ppt-master"
"vercel-labs/agent-browser",38333,2478,2026-01-11,"Browser automation CLI for AI agents","https://github.com/vercel-labs/agent-browser"
"OpenBMB/VoxCPM",33205,3793,2025-09-16,"VoxCPM2: Tokenizer-Free TTS for Multilingual Speech Generation, Creative Voice Design, and True-to-Life Cloning","https://github.com/OpenBMB/VoxCPM"
"K-Dense-AI/scientific-agent-skills",30754,3093,2025-10-19,"Turn any AI agent into an AI Scientist. The #1 Agent Skills library for science, used by 160,000+ scientists worldwide. 140 ready-to-use skills plus 100+ scientific databases covering biology, chemistry, medicine, and drug discovery. Compatible with Cursor, Claude Code, Codex, Pi, Antigravity, and the open Agent Skills standard.","https://github.com/K-Dense-AI/scientific-agent-skills"
"VoltAgent/awesome-agent-skills",27922,2988,2025-10-28,"A curated collection of 1000+ agent skills from official dev teams and the community, compatible with Claude Code, Codex, Gemini CLI, Cursor, and more.","https://github.com/VoltAgent/awesome-agent-skills"
"firecrawl/open-lovable",27388,5248,2025-08-08,"🔥 Clone and recreate any website as a modern React app in seconds","https://github.com/firecrawl/open-lovable"
"jarrodwatts/claude-hud",26354,1211,2026-01-02,"A Claude Code plugin that shows what's happening - context usage, active tools, running agents, and todo progress","https://github.com/jarrodwatts/claude-hud"
"zai-org/Open-AutoGLM",25757,4009,2025-12-08,"An Open Phone Agent Model & Framework. Unlocking the AI Phone for Everyone","https://github.com/zai-org/Open-AutoGLM"
"HKUDS/DeepTutor",25485,3482,2025-12-28,"DeepTutor: Lifelong Personalized Tutoring. https://deeptutor.info/.","https://github.com/HKUDS/DeepTutor"
"OthmanAdi/planning-with-files",25232,2131,2026-01-03,"Persistent file-based planning for AI coding agents and long-running agentic tasks. Crash-proof markdown plans that survive context loss and /clear, plus a deterministic completion gate and multi-agent shared state on disk. Manus-style. Works with Claude Code, Codex CLI, Cursor, Kiro, OpenCode and 60+ agents via the SKILL.md standard.","https://github.com/OthmanAdi/planning-with-files"
"ATH-MaaS/Pixelle-Video",25225,3636,2025-11-07,"🚀 AI 全自动短视频引擎 | AI Fully Automated Short Video Engine","https://github.com/ATH-MaaS/Pixelle-Video"
"toon-format/toon",24842,1104,2025-10-22,"🎒 Token-Oriented Object Notation (TOON) – Compact, human-readable, schema-aware JSON for LLM prompts. Spec, benchmarks, TypeScript SDK.","https://github.com/toon-format/toon"
"openai/skills",23583,1604,2025-11-25,"Skills Catalog for Codex","https://github.com/openai/skills"
"agentsmd/agents.md",22973,1704,2025-08-19,"AGENTS.md — a simple, open format for guiding coding agents","https://github.com/agentsmd/agents.md"
"2025Emma/vibe-coding-cn",22114,2351,2025-12-17,"","https://github.com/2025Emma/vibe-coding-cn"
"decolua/9router",21916,3696,2026-01-05,"Unlimited FREE AI coding. Connect Claude Code, Codex, Cursor, Cline, Copilot, Antigravity to FREE Claude/GPT/Gemini via 40+ providers. Auto-fallback, RTK -40% tokens, never hit limits.","https://github.com/decolua/9router"
"vectorize-io/hindsight",18269,1114,2025-10-30,"Hindsight: Agent Memory That  Learns","https://github.com/vectorize-io/hindsight"
"pranshuparmar/witr",18215,568,2025-12-20,"Why is this running?","https://github.com/pranshuparmar/witr"
"datawhalechina/easy-vibe",18087,1726,2025-12-28,"💻 vibe coding 2026 | Your First Modern Coding course beginners to master step by step.","https://github.com/datawhalechina/easy-vibe"
"can1357/oh-my-pi",17435,1575,2025-12-31,"⌥  AI Coding agent for the terminal — hash-anchored edits, optimized tool harness, LSP, Python, browser, subagents, and more","https://github.com/can1357/oh-my-pi"
"pascalorg/editor",17421,2368,2025-10-16,"Create and share 3D architectural projects.","https://github.com/pascalorg/editor"
"muratcankoylan/Agent-Skills-for-Context-Engineering",17086,1402,2025-12-21,"A comprehensive collection of Agent Skills for context engineering, multi-agent architectures, and production agent systems. Use when building, optimizing, or debugging agent systems that require effective context management.","https://github.com/muratcankoylan/Agent-Skills-for-Context-Engineering"
"gastownhall/gastown",16986,1558,2025-12-16,"Gas Town - multi-agent workspace manager","https://github.com/gastownhall/gastown"
"kurikomi-labs/komi-store",16491,627,2025-11-21,"🩵 A free, open-source app store for developers' releases on GitHub, Codeberg & Forgejo — browse, discover, and install apps with one click. Formerly GitHub Store.","https://github.com/kurikomi-labs/komi-store"
"Snapchat/Valdi",16390,543,2025-11-06,"Valdi is a cross-platform UI framework that delivers native performance without sacrificing developer velocity.","https://github.com/Snapchat/Valdi"
"a2ui-project/a2ui",15719,1232,2025-09-24,"","https://github.com/a2ui-project/a2ui"
"Anionex/banana-slides",15156,1756,2025-11-29,"一个基于nano banana pro🍌的原生AI PPT生成应用，迈向＂Vibe PPT＂; 支持上传任意模板图片，上传任意素材&智能解析，一句话/大纲/页面描述自动生成PPT，口头修改指定区域、一键导出可编辑ppt - An AI-native slides generator based on nano banana pro🍌","https://github.com/Anionex/banana-slides"
"KittenML/KittenTTS",15091,864,2025-08-05," State-of-the-art TTS model under 25MB 😻 ","https://github.com/KittenML/KittenTTS"
"ComposioHQ/awesome-codex-skills",14909,1428,2026-01-12,"A curated list of practical Codex skills for automating workflows across the Codex CLI and API.","https://github.com/ComposioHQ/awesome-codex-skills"
"alibaba/zvec",14812,921,2025-12-05,"A lightweight, lightning-fast, in-process vector database","https://github.com/alibaba/zvec"
"eigent-ai/eigent",14548,1721,2025-07-29,"Eigent: The Open Source Cowork Desktop to Unlock Your Exceptional Productivity. Local and Free Alternative to Claude Cowork.","https://github.com/eigent-ai/eigent"
"andrewyng/context-hub",13776,1199,2025-10-30,"","https://github.com/andrewyng/context-hub"
"originalankur/maptoposter",13763,1240,2026-01-08,"Transform your favorite cities into beautiful, minimalist designs. MapToPoster lets you create and export visually striking map posters with code.","https://github.com/originalankur/maptoposter"
"hardikpandya/stop-slop",13713,965,2026-01-11,"A skill file for removing AI tells from prose","https://github.com/hardikpandya/stop-slop"
