"name","stars","forks","created_at","summary","url"
"siddharthvaddem/openscreen",36601,2503,2025-10-10,"Create stunning demos for free. Open-source, no subscriptions, no watermarks, and free for commercial use. An alternative to Screen Studio. ","https://github.com/siddharthvaddem/openscreen"
"wshobson/agents",35671,3877,2025-07-24,"Intelligent automation and multi-agent orchestration for Claude Code","https://github.com/wshobson/agents"
"luongnv89/claude-howto",33531,4107,2025-11-07,"A visual, example-driven guide to Claude Code — from basic concepts to advanced agents, with copy-paste templates that bring immediate value.","https://github.com/luongnv89/claude-howto"
"pbakaus/impeccable",28956,1569,2025-11-16,"The design language that makes your AI harness better at design.","https://github.com/pbakaus/impeccable"
"hsliuping/TradingAgents-CN",26985,5723,2025-06-26,"基于多智能体LLM的中文金融交易框架 - TradingAgents中文增强版","https://github.com/hsliuping/TradingAgents-CN"
"apple/container",26553,755,2025-05-30,"A tool for creating and running Linux containers using lightweight virtual machines on a Mac. It is written in Swift, and optimized for Apple silicon. ","https://github.com/apple/container"
"Crosstalk-Solutions/project-nomad",26106,2587,2025-06-24,"Project N.O.M.A.D, is a self-contained, offline survival computer packed with critical tools, knowledge, and AI to keep you informed and empowered—anytime, anywhere.","https://github.com/Crosstalk-Solutions/project-nomad"
"virattt/dexter",25876,3165,2025-10-14,"An autonomous agent for deep financial research","https://github.com/virattt/dexter"
"iOfficeAI/AionUi",25862,2389,2025-08-07,"Free, local, open-source 24/7 Cowork app for OpenClaw, Hermes Agent, Claude Code, Codex, OpenCode, Gemini CLI and 20+ more CLI | Customize your assistants | Star if you like it!","https://github.com/iOfficeAI/AionUi"
"usestrix/strix",25414,2832,2025-08-05,"Open-source AI hackers to find and fix your app’s vulnerabilities.","https://github.com/usestrix/strix"
"shiyu-coder/Kronos",25343,4433,2025-07-01,"Kronos: A Foundation Model for the Language of Financial Markets","https://github.com/shiyu-coder/Kronos"
"QwenLM/qwen-code",24488,2391,2025-06-26,"An open-source AI agent that lives in your terminal.","https://github.com/QwenLM/qwen-code"
"toon-format/toon",24310,1079,2025-10-22,"🎒 Token-Oriented Object Notation (TOON) – Compact, human-readable, schema-aware JSON for LLM prompts. Spec, benchmarks, TypeScript SDK.","https://github.com/toon-format/toon"
"gastownhall/beads",23880,1581,2025-10-12,"Beads - A memory upgrade for your coding agent","https://github.com/gastownhall/beads"
"deepseek-ai/DeepSeek-OCR",23145,2140,2025-10-17,"Contexts Optical Compression","https://github.com/deepseek-ai/DeepSeek-OCR"
"basecamp/omarchy",23106,2316,2025-06-01,"Beautiful, Modern & Opinionated Linux","https://github.com/basecamp/omarchy"
"langchain-ai/deepagents",23030,3247,2025-07-27,"The batteries-included agent harness.","https://github.com/langchain-ai/deepagents"
"OpenListTeam/OpenList",22591,1973,2025-06-11,"A new AList Fork to Anti Trust Crisis","https://github.com/OpenListTeam/OpenList"
"VoltAgent/awesome-agent-skills",22359,2372,2025-10-28,"A curated collection of 1000+ agent skills from official dev teams and the community, compatible with Claude Code, Codex, Gemini CLI, Cursor, and more.","https://github.com/VoltAgent/awesome-agent-skills"
"czlonkowski/n8n-mcp",21119,3418,2025-06-07,"A MCP for Claude Desktop / Claude Code / Windsurf / Cursor to build n8n workflows for you ","https://github.com/czlonkowski/n8n-mcp"
"p-e-w/heretic",21075,2175,2025-09-21,"Fully automatic censorship removal for language models","https://github.com/p-e-w/heretic"
"slopus/happy",20932,1738,2025-07-18,"Mobile and Web client for Codex and Claude Code, with realtime voice, encryption and fully featured","https://github.com/slopus/happy"
"HKUDS/RAG-Anything",20400,2354,2025-06-06,"""RAG-Anything: All-in-One RAG Framework""","https://github.com/HKUDS/RAG-Anything"
"NirDiamant/agents-towards-production",20272,2684,2025-06-16,"End-to-end, code-first tutorials for building production-grade GenAI agents. From prototype to enterprise deployment.","https://github.com/NirDiamant/agents-towards-production"
"anthropics/claude-plugins-official",20165,2506,2025-11-20,"Official, Anthropic-managed directory of high quality Claude Code Plugins.","https://github.com/anthropics/claude-plugins-official"
"VoltAgent/awesome-claude-code-subagents",20151,2331,2025-07-30,"A collection of 100+ specialized Claude Code subagents covering a wide range of development use cases","https://github.com/VoltAgent/awesome-claude-code-subagents"
"openai/gpt-oss",20108,2079,2025-06-23,"gpt-oss-120b and gpt-oss-20b are two open-weight language models by OpenAI","https://github.com/openai/gpt-oss"
"HKUDS/AI-Trader",18235,2782,2025-10-23,"""AI-Trader: 100% Fully-Automated Agent-Native Trading""  ","https://github.com/HKUDS/AI-Trader"
"google-gemini/gemini-fullstack-langgraph-quickstart",18174,3077,2025-05-22,"Get started with building Fullstack Agents using Gemini 2.5 and LangGraph","https://github.com/google-gemini/gemini-fullstack-langgraph-quickstart"
"Nagi-ovo/gemini-voyager",18054,569,2025-10-04,"An all-in-one enhancement suite for Google Gemini & AI Studio - timeline navigation, folder management, prompt library, and chat export in one powerful extension. / Google Gemini & AI Studio 全能增强插件：集成时间轴导航、文件夹管理、提示词库及聊天导出等众多功能。","https://github.com/Nagi-ovo/gemini-voyager"
