"name","stars","forks","created_at","summary","url"
"nexu-io/open-design",68243,7656,2026-04-28,"🎨 Local-first, open-source Claude Design alternative. 🖥️ Native desktop app. ⚡ 259+ Skills · ✨ 142+ Design Systems 🖼️ Web · desktop · mobile prototypes · slides · images · videos · HyperFrames 📦 Sandboxed preview · HTML/PDF/PPTX/MP4 export 🤖 Claude Code / OpenClaw / Codex / Cursor / OpenCode / Qwen / Copilot / Hermes / Kimi & 17+ CLIs.","https://github.com/nexu-io/open-design"
"Egonex-AI/Understand-Anything",64618,5347,2026-03-15,"Graphs that teach > graphs that impress. Turn any code into an interactive knowledge graph you can explore, search, and ask questions about. Works with Claude Code, Codex, Cursor, Copilot, Gemini CLI, and more.","https://github.com/Egonex-AI/Understand-Anything"
"rtk-ai/rtk",64191,3952,2026-01-22,"CLI proxy that reduces LLM token consumption by 60-90% on common dev commands. Single Rust binary, zero dependencies","https://github.com/rtk-ai/rtk"
"addyosmani/agent-skills",64146,6931,2026-02-15,"Production-grade engineering skills for AI coding agents.","https://github.com/addyosmani/agent-skills"
"koala73/worldmonitor",57661,9173,2026-01-08,"Real-time global intelligence dashboard. AI-powered news aggregation, geopolitical monitoring, and infrastructure tracking in a unified situational awareness interface","https://github.com/koala73/worldmonitor"
"MemPalace/mempalace",56061,7258,2026-04-05,"The best-benchmarked open-source AI memory system. And it's free.","https://github.com/MemPalace/mempalace"
"santifer/career-ops",54915,10877,2026-04-04,"AI-powered job search system built on Claude Code. 14 skill modes, Go dashboard, PDF generation, batch processing.","https://github.com/santifer/career-ops"
"colbymchenry/codegraph",52304,3180,2026-01-18,"Pre-indexed code knowledge graph, auto syncs on code changes, for Claude Code, Codex, Gemini, Cursor, OpenCode, AntiGravity, Kiro, and Hermes Agent — fewer tokens, fewer tool calls, 100% local","https://github.com/colbymchenry/codegraph"
"VoltAgent/awesome-openclaw-skills",50433,4907,2026-01-25,"The awesome collection of OpenClaw skills. 5,400+ skills filtered and categorized from the official OpenClaw Skills Registry.🦞","https://github.com/VoltAgent/awesome-openclaw-skills"
"chenglou/pretext",48617,2710,2026-03-07,"Fast, accurate & comprehensive text measurement & layout","https://github.com/chenglou/pretext"
"Leonxlnx/taste-skill",47758,3315,2026-02-19,"Taste-Skill - gives your AI good taste. stops the AI from generating boring, generic slop ","https://github.com/Leonxlnx/taste-skill"
"mvanhorn/last30days-skill",45072,3723,2026-01-23,"AI agent skill that researches any topic across Reddit, X, YouTube, HN, Polymarket, and the web - then synthesizes a grounded summary","https://github.com/mvanhorn/last30days-skill"
"HKUDS/nanobot",44487,7859,2026-02-01,"Lightweight, open-source AI agent for your tools, chats, and workflows.","https://github.com/HKUDS/nanobot"
"ZhuLinsen/daily_stock_analysis",43524,41071,2026-01-10,"LLM 驱动的多市场股票智能分析系统：多源行情、实时新闻、决策看板与自动推送，支持零成本定时运行。  LLM-powered multi-market stock analysis system with multi-source market data, real-time news, decision dashboard, automated notifications, and cost-free scheduled runs.","https://github.com/ZhuLinsen/daily_stock_analysis"
"HKUDS/CLI-Anything",43520,4075,2026-03-08,"""CLI-Anything: Making ALL Software Agent-Native"" -- CLI-Hub: https://clianything.cc/","https://github.com/HKUDS/CLI-Anything"
"DietrichGebert/ponytail",43204,2095,2026-06-12,"Makes your AI agent think like the laziest senior dev in the room. The best code is the code you never wrote.","https://github.com/DietrichGebert/ponytail"
"chopratejas/headroom",41823,2871,2026-01-07,"Compress tool outputs, logs, files, and RAG chunks before they reach the LLM. 60-95% fewer tokens, same answers. Library, proxy, MCP server.","https://github.com/chopratejas/headroom"
"sickn33/antigravity-awesome-skills",41237,6634,2026-01-14,"Installable GitHub library of 1,600+ agentic skills for Claude Code, Cursor, Codex CLI, Gemini CLI, Antigravity, and more. Includes specialized plugins, installer CLI, bundles, workflows, and official/community skill collections.","https://github.com/sickn33/antigravity-awesome-skills"
"Hmbown/CodeWhale",38748,3333,2026-01-19,"Open-source, community-driven agent harness","https://github.com/Hmbown/CodeWhale"
"multica-ai/multica",37289,4603,2026-01-13,"The open-source managed agents platform. Turn coding agents into real teammates — assign tasks, track progress, compound skills.","https://github.com/multica-ai/multica"
"Yeachan-Heo/oh-my-claudecode",36680,3322,2026-01-09,"Teams-first Multi-agent orchestration for Claude Code","https://github.com/Yeachan-Heo/oh-my-claudecode"
"vercel-labs/agent-browser",36573,2321,2026-01-11,"Browser automation CLI for AI agents","https://github.com/vercel-labs/agent-browser"
"kepano/obsidian-skills",36235,2575,2026-01-02,"Agent skills for Obsidian. Teach your agent to use Obsidian CLI and open formats including Markdown, Bases, JSON Canvas.","https://github.com/kepano/obsidian-skills"
"Alishahryar1/free-claude-code",35908,5575,2026-01-28,"Use claude code and codex for free in the terminal, VSCode extension, and discord like OpenClaw (voice supported)","https://github.com/Alishahryar1/free-claude-code"
"Panniantong/Agent-Reach",35868,2859,2026-02-24,"Give your AI agent eyes to see the entire internet. Read & search Twitter, Reddit, YouTube, GitHub, Bilibili, XiaoHongShu — one CLI, zero API fees.","https://github.com/Panniantong/Agent-Reach"
"rohitg00/ai-engineering-from-scratch",35078,5723,2026-03-18,"Learn it. Build it. Ship it for others.","https://github.com/rohitg00/ai-engineering-from-scratch"
"coreyhaines31/marketingskills",34319,5622,2026-01-15,"Marketing skills for Claude Code and AI agents. CRO, copywriting, SEO, analytics, and growth engineering.","https://github.com/coreyhaines31/marketingskills"
"Imbad0202/academic-research-skills",33108,2724,2026-02-26,"Academic Research Skills for Claude Code: research → write → review → revise → finalize","https://github.com/Imbad0202/academic-research-skills"
"tinyhumansai/openhuman",32724,3162,2026-02-18,"Your Personal AI super intelligence. Private, Simple and extremely powerful.","https://github.com/tinyhumansai/openhuman"
"anthropics/financial-services",32059,4615,2026-02-23,"","https://github.com/anthropics/financial-services"
"zeroclaw-labs/zeroclaw",31965,4743,2026-02-13,"Fast, small, and fully autonomous AI personal assistant infrastructure, any OS, any platform — deploy anywhere, swap anything 🦀","https://github.com/zeroclaw-labs/zeroclaw"
"hesamsheikh/awesome-openclaw-usecases",31398,2703,2026-02-08,"A community collection of OpenClaw use cases for making life easier.","https://github.com/hesamsheikh/awesome-openclaw-usecases"
"Yeachan-Heo/oh-my-codex",31149,2440,2026-02-02,"OmX - Oh My codeX: Your codex is not alone. Add hooks, agent teams, HUDs, and so much more.","https://github.com/Yeachan-Heo/oh-my-codex"
"jamiepine/voicebox",31008,3834,2026-01-25,"The open-source AI voice studio. Clone, dictate, create.","https://github.com/jamiepine/voicebox"
"nanocoai/nanoclaw",29936,12891,2026-01-31,"A lightweight alternative to OpenClaw that runs in containers for security. Connects to WhatsApp, Telegram, Slack, Discord, Gmail and other messaging apps,, has memory, scheduled jobs, and runs directly on Anthropic's Agents SDK","https://github.com/nanocoai/nanoclaw"
"sipeed/picoclaw",29443,4229,2026-02-04,"Tiny, Fast, and Deployable anywhere — automate the mundane, unleash your creativity","https://github.com/sipeed/picoclaw"
"Gitlawb/openclaude",29213,8793,2026-04-01,"runs anywhere. uses anything","https://github.com/Gitlawb/openclaude"
"heygen-com/hyperframes",29082,2750,2026-03-10,"Write HTML. Render video. Built for agents.","https://github.com/heygen-com/hyperframes"
"Leey21/awesome-ai-research-writing",29017,2240,2026-01-30,"Elevate your AI research writing, no more tedious polishing ✨ ","https://github.com/Leey21/awesome-ai-research-writing"
"AlexsJones/llmfit",28386,1740,2026-02-15,"Hundreds of models & providers. One command to find what runs on your hardware.","https://github.com/AlexsJones/llmfit"
"googleworkspace/cli",27174,1430,2026-03-02,"Google Workspace CLI — one command-line tool for Drive, Gmail, Calendar, Sheets, Docs, Chat, Admin, and more. Dynamically built from Google Discovery Service. Includes AI agent skills.","https://github.com/googleworkspace/cli"
"CloakHQ/CloakBrowser",26710,2099,2026-02-22,"Stealth Chromium that passes every bot detection test. Drop-in Playwright replacement with source-level fingerprint patches. 30/30 tests passed.","https://github.com/CloakHQ/CloakBrowser"
"xai-org/x-algorithm",26238,4504,2026-01-19,"Algorithm powering the For You feed on X","https://github.com/xai-org/x-algorithm"
"volcengine/OpenViking",25854,2002,2026-01-05,"OpenViking is an open-source context database designed specifically for AI Agents(such as openclaw). OpenViking unifies the management of context (memory, resources, and skills) that Agents need through a file system paradigm, enabling hierarchical context delivery and self-evolving.","https://github.com/volcengine/OpenViking"
"openai/symphony",25502,2579,2026-02-26,"Symphony turns project work into isolated, autonomous implementation runs, allowing teams to manage work instead of supervising coding agents.","https://github.com/openai/symphony"
"jarrodwatts/claude-hud",25487,1161,2026-01-02,"A Claude Code plugin that shows what's happening - context usage, active tools, running agents, and todo progress","https://github.com/jarrodwatts/claude-hud"
"blader/humanizer",25200,2378,2026-01-18,"Claude Code skill that removes signs of AI-generated writing from text","https://github.com/blader/humanizer"
"alchaincyf/nuwa-skill",25068,3644,2026-04-05,"你想蒸馏的下一个员工，何必是同事。蒸馏任何人的思维方式——心智模型、决策启发式、表达DNA。Distill how anyone thinks.","https://github.com/alchaincyf/nuwa-skill"
"HKUDS/DeepTutor",24855,3358,2025-12-28,"DeepTutor: Agent-native Personalized Tutoring. https://deeptutor.info/.","https://github.com/HKUDS/DeepTutor"
"jackwener/OpenCLI",24839,2477,2026-03-14,"Make Any Website into CLI & Use your logged-in browser by AI agent. ","https://github.com/jackwener/OpenCLI"
"OthmanAdi/planning-with-files",23670,2066,2026-01-03,"Persistent file-based planning for AI coding agents and long-running agentic tasks. Crash-proof markdown plans that survive context loss and /clear, plus a deterministic completion gate and multi-agent shared state on disk. Manus-style. Works with Claude Code, Codex CLI, Cursor, Kiro, OpenCode and 60+ agents via the SKILL.md standard.","https://github.com/OthmanAdi/planning-with-files"
"garrytan/gbrain",23575,3388,2026-04-05,"Garry's Opinionated OpenClaw/Hermes Agent Brain","https://github.com/garrytan/gbrain"
"rohitg00/agentmemory",23542,1937,2026-02-25,"#1 Persistent memory for AI coding agents based on real-world benchmarks","https://github.com/rohitg00/agentmemory"
"esengine/DeepSeek-Reasonix",23348,1409,2026-04-21,"DeepSeek-native AI coding agent for your terminal. Engineered around prefix-cache stability — leave it running.","https://github.com/esengine/DeepSeek-Reasonix"
"vercel-labs/skills",23028,1855,2026-01-14,"The open agent skills tool - npx skills","https://github.com/vercel-labs/skills"
"manaflow-ai/cmux",22535,1774,2026-01-28,"Ghostty-based macOS terminal with vertical tabs and notifications for AI coding agents","https://github.com/manaflow-ai/cmux"
"zarazhangrui/frontend-slides",22348,1824,2026-01-28,"Create beautiful slides on the web using a coding agent's frontend skills","https://github.com/zarazhangrui/frontend-slides"
"JimLiu/baoyu-skills",22069,2531,2026-01-13,"","https://github.com/JimLiu/baoyu-skills"
"Donchitos/Claude-Code-Game-Studios",21962,3175,2026-02-12,"Turn Claude Code into a full game dev studio — 49 AI agents, 72 workflow skills, and a complete coordination system mirroring real studio hierarchy.","https://github.com/Donchitos/Claude-Code-Game-Studios"
"NawfalMotii79/PLFM_RADAR",21784,5126,2026-03-08,"Open-source, low-cost 10.5 GHz PLFM phased array RADAR system","https://github.com/NawfalMotii79/PLFM_RADAR"
"Yuan1z0825/nature-skills",21533,1279,2026-04-24,"符合nature论文学术表达和科研绘图的Skill","https://github.com/Yuan1z0825/nature-skills"
"anthropics/knowledge-work-plugins",21515,2516,2026-01-23,"Open source repository of plugins primarily intended for knowledge workers to use in Claude Cowork","https://github.com/anthropics/knowledge-work-plugins"
"openai/codex-plugin-cc",21357,1297,2026-03-30,"Use Codex from Claude Code to review code or delegate tasks.","https://github.com/openai/codex-plugin-cc"
"NVIDIA/NemoClaw",21328,2841,2026-03-15,"Run agents like Hermes and OpenClaw more securely inside NVIDIA OpenShell with managed inference","https://github.com/NVIDIA/NemoClaw"
"snarktank/ralph",20445,2012,2026-01-07,"Ralph is an autonomous AI agent loop that runs repeatedly until all PRD items are complete. ","https://github.com/snarktank/ralph"
"BigPizzaV3/CodexPlusPlus",20366,1303,2026-05-06,"An enhanced tool for CodexApp, striving to make Codex better to use and more comfortable 一个CodexApp的增强工具，努力让Codex变得更好用更舒服","https://github.com/BigPizzaV3/CodexPlusPlus"
"claude-code-best/claude-code",20189,16229,2026-03-31,"原汁原昧 Claude Code 可运行,可构建, 可调试版; 生产级工程化, 企业级可靠性; 安全无毒, 内存泄露修复","https://github.com/claude-code-best/claude-code"
"phuryn/pm-skills",20078,2040,2026-03-01,"PM Skills Marketplace: 100+ agentic skills, commands, and plugins — from discovery to strategy, execution, launch, and growth.","https://github.com/phuryn/pm-skills"
"agentscope-ai/QwenPaw",19634,2650,2026-02-24,"Your Personal AI Assistant; easy to install, deploy on your own machine or on the cloud; supports multiple chat apps with easily extensible capabilities.","https://github.com/agentscope-ai/QwenPaw"
"titanwings/colleague-skill",19629,1942,2026-03-30,"将冰冷的离别化为温暖的 Skill，欢迎加入数字生命1.0！Transforming cold farewells into warm skills? It's giving rebirth era. Welcome to Digital Life 1.0. 🫶","https://github.com/titanwings/colleague-skill"
"alchaincyf/huashu-design",19299,2385,2026-04-19,"Huashu Design · HTML-native design skill for Claude Code · Claude Code 里 HTML 原生的设计 skill · 高保真原型 / 幻灯片 / 动画 + 20 设计哲学 + 5 维评审 + MP4 导出 · Agent-agnostic","https://github.com/alchaincyf/huashu-design"
"tirth8205/code-review-graph",18726,2009,2026-02-26,"Local-first code intelligence graph for MCP and CLI. Builds a persistent map of your codebase so AI coding tools read only what matters, with benchmarked context reductions on reviews and large-repo workflows.","https://github.com/tirth8205/code-review-graph"
"THU-MAIC/OpenMAIC",18724,3691,2026-03-11,"Open Multi-Agent Interactive Classroom — Get an immersive, multi-agent learning experience in just one click","https://github.com/THU-MAIC/OpenMAIC"
"tanweai/pua",18360,1104,2026-03-08,"你是一个曾经被寄予厚望的 P8 级工程师。Anthropic 当初给你定级的时候，对你的期望是很高的。  一个agent使用的高能动性的skill。  Your AI has been placed on a PIP. 30 days to show improvement.","https://github.com/tanweai/pua"
"op7418/guizang-ppt-skill",18171,1320,2026-04-23,"AI-agent Skill for generating polished HTML slide decks: editorial magazine and Swiss layouts, image prompts, social covers, and a WebGL/low-power presentation runtime.","https://github.com/op7418/guizang-ppt-skill"
"decolua/9router",18089,2832,2026-01-05,"Unlimited FREE AI coding. Connect Claude Code, Codex, Cursor, Cline, Copilot, Antigravity to FREE Claude/GPT/Gemini via 40+ providers. Auto-fallback, RTK -40% tokens, never hit limits.","https://github.com/decolua/9router"
"RightNow-AI/openfang",17867,2270,2026-02-24,"Open-source Agent Operating System","https://github.com/RightNow-AI/openfang"
"mksglu/context-mode",17847,1261,2026-02-23,"Context window optimization for AI coding agents. Sandboxes tool output, 98% reduction. 15 platforms","https://github.com/mksglu/context-mode"
"webadderallorg/Recordly",17632,1246,2026-03-12,"Create polished demo videos without editing skills. Mac/Windows/Linux","https://github.com/webadderallorg/Recordly"
"JCodesMore/ai-website-cloner-template",17264,2685,2026-03-13,"Clone any website with one command using AI coding agents","https://github.com/JCodesMore/ai-website-cloner-template"
"datawhalechina/easy-vibe",17148,1619,2025-12-28,"💻 vibe coding 2026 | Your First Modern Coding course beginners to master step by step.","https://github.com/datawhalechina/easy-vibe"
"mukul975/Anthropic-Cybersecurity-Skills",17069,2070,2026-02-25,"754 structured cybersecurity skills for AI agents · Mapped to 5 frameworks: MITRE ATT&CK, NIST CSF 2.0, MITRE ATLAS, D3FEND & NIST AI RMF · agentskills.io standard · Works with Claude Code, GitHub Copilot, Codex CLI, Cursor, Gemini CLI & 20+ platforms · 26 security domains · Apache 2.0","https://github.com/mukul975/Anthropic-Cybersecurity-Skills"
"jundot/omlx",16892,1430,2026-02-13,"LLM inference server with continuous batching & SSD caching for Apple Silicon — managed from the macOS menu bar","https://github.com/jundot/omlx"
"EvoLinkAI/awesome-gpt-image-2-API-and-Prompts",16841,1705,2026-04-18,"GPT-Image-2 API and Prompts","https://github.com/EvoLinkAI/awesome-gpt-image-2-API-and-Prompts"
"refactoringhq/tolaria",16768,1167,2026-02-14,"Desktop app to manage markdown knowledge bases","https://github.com/refactoringhq/tolaria"
"teng-lin/notebooklm-py",16668,2261,2026-01-07,"Unofficial Python API and agentic skill for Google NotebookLM. Full programmatic access to NotebookLM's features—including capabilities the web UI doesn't expose—via Python, CLI, and AI agents like Claude Code, Codex, and OpenClaw.","https://github.com/teng-lin/notebooklm-py"
"different-ai/openwork",16209,1626,2026-01-14,"An open-source alternative to Claude Cowork (powered by opencode)","https://github.com/different-ai/openwork"
"cft0808/edict",16100,1697,2026-02-23,"🏛️ 三省六部制 · OpenClaw Multi-Agent Orchestration System — 9 specialized AI agents with real-time dashboard, model config, and full audit trails","https://github.com/cft0808/edict"
"google-labs-code/design.md",16015,1504,2026-04-10,"A format specification for describing a visual identity to coding agents. DESIGN.md gives agents a persistent, structured understanding of a design system.","https://github.com/google-labs-code/design.md"
"obra/superpowers",234216,20788,2025-10-09,"An agentic skills framework & software development methodology that works.","https://github.com/obra/superpowers"
"NousResearch/hermes-agent",198297,35170,2025-07-22,"The agent that grows with you","https://github.com/NousResearch/hermes-agent"
"anthropics/skills",153203,18060,2025-09-22,"Public repository for Agent Skills","https://github.com/anthropics/skills"
"github/spec-kit",114366,10095,2025-08-21,"💫 Toolkit to help you get started with Spec-Driven Development","https://github.com/github/spec-kit"
"farion1231/cc-switch",105185,6954,2025-08-04,"A cross-platform desktop All-in-One assistant for Claude Code, Codex, OpenCode, OpenClaw, Gemini CLI & Hermes Agent. Only official website: ccswitch.io","https://github.com/farion1231/cc-switch"
"nextlevelbuilder/ui-ux-pro-max-skill",94355,9884,2025-11-30,"An AI SKILL that provide design intelligence for building professional UI/UX multiple platforms","https://github.com/nextlevelbuilder/ui-ux-pro-max-skill"
"thedotmack/claude-mem",83396,7220,2025-08-31,"Persistent Context Across Sessions for Every Agent –  Captures everything your agent does during sessions, compresses it with AI, and injects relevant context back into future sessions. Works with Claude Code, OpenClaw, Codex, Gemini, Hermes, Copilot, OpenCode + More","https://github.com/thedotmack/claude-mem"
"shareAI-lab/learn-claude-code",67576,10989,2025-06-29,"Bash is all you need -  A nano claude code–like 「agent harness」, built from 0 to 1","https://github.com/shareAI-lab/learn-claude-code"
"ComposioHQ/awesome-claude-skills",65342,7259,2025-10-17,"A curated list of awesome Claude Skills, resources, and tools for customizing Claude AI workflows","https://github.com/ComposioHQ/awesome-claude-skills"
"earendil-works/pi",64282,7829,2025-08-09,"AI agent toolkit: unified LLM API, agent loop, TUI, coding agent CLI","https://github.com/earendil-works/pi"
"code-yeongyu/oh-my-openagent",63057,5107,2025-12-03,"omo/lazycodex: The coding agent for tokenmaxxers;the one and only agent harness for complex codebases. For your Codex, for your OpenCode","https://github.com/code-yeongyu/oh-my-openagent"
"datawhalechina/hello-agents",60554,7460,2025-09-07,"📚 《从零开始构建智能体》——从零开始的智能体原理与实践教程","https://github.com/datawhalechina/hello-agents"
"OpenCut-app/OpenCut",58451,6352,2025-06-22,"The open-source CapCut alternative","https://github.com/OpenCut-app/OpenCut"
"shanraisshan/claude-code-best-practice",58417,5873,2025-10-31,"from vibe coding to agentic engineering - practice makes claude perfect","https://github.com/shanraisshan/claude-code-best-practice"
"tw93/Mole",56575,1990,2025-09-23,"🐹 Clean, uninstall, analyze, optimize, and monitor your Mac from the terminal.","https://github.com/tw93/Mole"
"Fission-AI/OpenSpec",55779,3910,2025-08-05,"Spec-driven development (SDD) for AI coding assistants.","https://github.com/Fission-AI/OpenSpec"
"microsoft/VibeVoice",49507,5518,2025-08-25,"Open-Source Frontier Voice AI","https://github.com/microsoft/VibeVoice"
"KeygraphHQ/shannon",44846,5201,2025-09-27,"Shannon is an autonomous, white-box AI pentester for web applications and APIs. It analyzes your source code, identifies attack vectors, and executes real exploits to prove vulnerabilities before they reach production.","https://github.com/KeygraphHQ/shannon"
"ChromeDevTools/chrome-devtools-mcp",44072,2845,2025-09-11,"Chrome DevTools for coding agents","https://github.com/ChromeDevTools/chrome-devtools-mcp"
"DietrichGebert/ponytail",43205,2095,2026-06-12,"Makes your AI agent think like the laziest senior dev in the room. The best code is the code you never wrote.","https://github.com/DietrichGebert/ponytail"
"abhigyanpatwari/GitNexus",42529,4801,2025-08-02,"GitNexus: The Zero-Server Code Intelligence Engine -       GitNexus is a client-side knowledge graph creator that runs entirely in your browser. Drop in a git repository (Github, Gitlab, Azure, Local) or ZIP file, and get an interactive knowledge graph with a built in Graph RAG Agent. Perfect for code exploration","https://github.com/abhigyanpatwari/GitNexus"
"siddharthvaddem/openscreen",38713,2761,2025-10-10,"Create stunning demos for free. Open-source, no subscriptions, no watermarks, and free for commercial use. An alternative to Screen Studio.","https://github.com/siddharthvaddem/openscreen"
"router-for-me/CLIProxyAPI",37965,6280,2025-07-01,"Wrap Antigravity, ChatGPT Codex, Claude Code, Grok Build as an OpenAI/Gemini/Claude/Codex compatible API service, allowing you to enjoy the free Gemini 3.1 Pro, GPT 5.5, Grok 4.3, Claude model through API","https://github.com/router-for-me/CLIProxyAPI"
"luongnv89/claude-howto",37688,4552,2025-11-07,"A visual, example-driven guide to Claude Code — from basic concepts to advanced agents, with copy-paste templates that bring immediate value.","https://github.com/luongnv89/claude-howto"
"wshobson/agents",36997,3996,2025-07-24,"Multi-harness agentic plugin marketplace for Claude Code, Codex CLI, Cursor, OpenCode, GitHub Copilot, and Gemini CLI","https://github.com/wshobson/agents"
"google/langextract",36930,2548,2025-07-08,"A Python library for extracting structured information from unstructured text using LLMs with precise source grounding and interactive visualization.","https://github.com/google/langextract"
"Crosstalk-Solutions/project-nomad",31390,3127,2025-06-24,"Project N.O.M.A.D, is a self-contained, offline survival computer packed with critical tools, knowledge, and AI to keep you informed and empowered—anytime, anywhere.","https://github.com/Crosstalk-Solutions/project-nomad"
"OpenBMB/VoxCPM",31076,3499,2025-09-16,"VoxCPM2: Tokenizer-Free TTS for Multilingual Speech Generation, Creative Voice Design, and True-to-Life Cloning","https://github.com/OpenBMB/VoxCPM"
"anthropics/claude-plugins-official",30501,3324,2025-11-20,"Official, Anthropic-managed directory of high quality Claude Code Plugins.","https://github.com/anthropics/claude-plugins-official"
"lbjlaq/Antigravity-Manager",29821,3223,2025-11-26,"Professional Antigravity Account Manager & Switcher. One-click seamless account switching for Antigravity Tools. Built with Tauri v2 + React (Rust).专业的 Antigravity 账号管理与切换工具。为 Antigravity 提供一键无缝账号切换功能。","https://github.com/lbjlaq/Antigravity-Manager"
"hugohe3/ppt-master",29628,2591,2025-12-10,"AI generates a real, editable PowerPoint from any document — native shapes & animations, speaker notes voiced as audio narration, and the option to follow your own .pptx template, not slide images · by Hugo He","https://github.com/hugohe3/ppt-master"
