"name","stars","forks","created_at","summary","url"
"nhutdang198/AI-Final-fantasy-6-remake",238,0,2026-05-19,"ai final fantasy 6 remake: Release download free github fan made game pcwatch viral 3d trailer, , hironobu sakaguchi awesome tweet reaction, square enix 20 years kitase. desusanJP x video, sabin phantom train suplex ai, tina terra theme bgm teaser, ai slop controversy reddit, akitoshi kawazu response, play pixel remaster hd graphics mod.","https://github.com/nhutdang198/AI-Final-fantasy-6-remake"
"haidang1810/md2html",231,16,2026-05-14,"Your AI writes docs — md2html turns them into pages people actually read. A portable skill for Claude Code / Codex / Antigravity that converts long-form Markdown (plans, specs, system designs, RFCs, runbooks, postmortems, brainstorms) into self-contained HTML with Mermaid, timelines, callouts, TOC. Multi-language.","https://github.com/haidang1810/md2html"
"bishopscode/Yoshi-and-the-Mysterious-Book-PC",227,0,2026-05-19,"Yoshi and the Mysterious Book review metacritic release date PC: download yoshi game ryujinx yuzu emulator config, yosshī to fukashigi no zukan rom, prod keys title keys zip. nintendo switch 2 emulator pc, shaders cache free download, fitgirl repack  rumors, good-feel mr e encyclopedia, controls mapping keyboard, 60 fps hack mo","https://github.com/bishopscode/Yoshi-and-the-Mysterious-Book-PC"
"heyFive-dev/Polymarket-Arbitrage-Trading-Bot-v2",223,1414,2026-05-14,"Polymarket Trading Bot Polymarket Trading Bot Polymarket Trading Bot Polymarket Trading Bot Polymarket Trading Bot Polymarket Trading Bot Polymarket Trading Bot Polymarket Trading Bot  Polymarket Trading Bot Polymarket Trading Bot Polymarket Trading Bot Polymarket Trading Bot Polymarket Trading Bot Polymarket Trading Bot Polymarket Trading Bot","https://github.com/heyFive-dev/Polymarket-Arbitrage-Trading-Bot-v2"
"Signal-Probability-Engine/weather-prediction",220,2016,2026-05-14,"Polymarket weather trading bot Polymarket trading bot Polymarket trading bot Polymarket trading bot Polymarket trading bot Polymarket trading bot Polymarket trading bot Polymarket trading bot Polymarket trading bot Polymarket trading bot Polymarket trading bot Polymarket trading bot Polymarket trading bot Polymarket polymarket trading bot bot bot","https://github.com/Signal-Probability-Engine/weather-prediction"
"SalhaNabil/CloakBrowser",216,0,2026-05-19,"CloakBrowser Github: anti-detect browser download, source-level chromium patches, browser fingerprinting spoofing, multi-accounting tool, canvas webgl modification, proxy manager http socks5, cookie isolation, session import export, user-agent switcher, puppeteer playwright automation api, profile sharing, web scraping free, github ","https://github.com/SalhaNabil/CloakBrowser"
"PandoraReads/apex-dashboard",214,9,2026-05-14,"Stop switching between Obsidian notes. One page. Everything you need. Memo your thoughts, crush your todos, track your projects — and make it look incredible doing it.","https://github.com/PandoraReads/apex-dashboard"
"FoundZiGu/GuJumpgate",207,92,2026-05-19,"","https://github.com/FoundZiGu/GuJumpgate"
"agent-quality-controls/slopless",198,21,2026-05-16,"Deterministic textlint rules and CLI for catching prose slop in Markdown","https://github.com/agent-quality-controls/slopless"
"openclaw/openclaw",373260,77454,2025-11-24,"Your own personal AI assistant. Any OS. Any Platform. The lobster way. 🦞 ","https://github.com/openclaw/openclaw"
"ultraworkers/claw-code",192016,109953,2026-03-31,"The repo is finally unlocked. enjoy the party! The fastest repo in history to surpass 100K stars ⭐. Join Discord: https://discord.gg/5TUQKqFWd Built in Rust using oh-my-codex.","https://github.com/ultraworkers/claw-code"
"affaan-m/ECC",187173,28984,2026-01-18,"The agent harness performance optimization system. Skills, instincts, memory, security, and research-first development for Claude Code, Codex, Opencode, Cursor and beyond.","https://github.com/affaan-m/ECC"
"multica-ai/andrej-karpathy-skills",137949,14136,2026-01-27,"A single CLAUDE.md file to improve Claude Code behavior, derived from Andrej Karpathy's observations on LLM coding pitfalls.","https://github.com/multica-ai/andrej-karpathy-skills"
"garrytan/gstack",99544,14848,2026-03-11,"Use Garry Tan's exact Claude Code setup: 23 opinionated tools that serve as CEO, Designer, Eng Manager, Release Manager, Doc Engineer, and QA","https://github.com/garrytan/gstack"
"mattpocock/skills",94413,8309,2026-02-03,"Skills for Real Engineers. Straight from my .claude directory.","https://github.com/mattpocock/skills"
"karpathy/autoresearch",82004,11913,2026-03-06,"AI agents running research on single-GPU nanochat training automatically","https://github.com/karpathy/autoresearch"
"VoltAgent/awesome-design-md",81332,9812,2026-03-31,"A collection of DESIGN.md files inspired by popular brand design systems. Drop one into your project and let coding agents generate a matching UI.","https://github.com/VoltAgent/awesome-design-md"
"nextlevelbuilder/ui-ux-pro-max-skill",80608,8293,2025-11-30,"An AI SKILL that provide design intelligence for building professional UI/UX multiple platforms","https://github.com/nextlevelbuilder/ui-ux-pro-max-skill"
"paperclipai/paperclip",66600,12187,2026-03-02,"The open-source app everyone uses to manage agents at work","https://github.com/paperclipai/paperclip"
"gsd-build/get-shit-done",63150,5366,2025-12-14,"A light-weight and powerful meta-prompting, context engineering and spec-driven development system for Claude Code by TÂCHES.","https://github.com/gsd-build/get-shit-done"
"JuliusBrussee/caveman",62323,3483,2026-04-04,"🪨 why use many token when few token do trick — Claude Code skill that cuts 65% of tokens by talking like caveman","https://github.com/JuliusBrussee/caveman"
"666ghj/MiroFish",61288,9598,2025-11-26,"A Simple and Universal Swarm Intelligence Engine, Predicting Anything. 简洁通用的群体智能引擎，预测万物","https://github.com/666ghj/MiroFish"
"code-yeongyu/oh-my-openagent",58590,4756,2025-12-03,"omo; the best agent harness - previously oh-my-opencode","https://github.com/code-yeongyu/oh-my-openagent"
"koala73/worldmonitor",54478,8765,2026-01-08,"Real-time global intelligence dashboard. AI-powered news aggregation, geopolitical monitoring, and infrastructure tracking in a unified situational awareness interface","https://github.com/koala73/worldmonitor"
"MemPalace/mempalace",52505,6931,2026-04-05,"The best-benchmarked open-source AI memory system. And it's free.","https://github.com/MemPalace/mempalace"
"rtk-ai/rtk",50858,3101,2026-01-22,"CLI proxy that reduces LLM token consumption by 60-90% on common dev commands. Single Rust binary, zero dependencies","https://github.com/rtk-ai/rtk"
"safishamsi/graphify",49658,5387,2026-04-03,"AI coding assistant skill (Claude Code, Codex, OpenCode, Cursor, Gemini CLI, and more). Turn any folder of code, SQL schemas, R scripts, shell scripts, docs, papers, images, or videos into a queryable knowledge graph. App code + database schema + infrastructure in one graph.","https://github.com/safishamsi/graphify"
"VoltAgent/awesome-openclaw-skills",49029,4796,2026-01-25,"The awesome collection of OpenClaw skills. 5,400+ skills filtered and categorized from the official OpenClaw Skills Registry.🦞","https://github.com/VoltAgent/awesome-openclaw-skills"
"chenglou/pretext",47205,2605,2026-03-07,"Fast, accurate & comprehensive text measurement & layout","https://github.com/chenglou/pretext"
"nexu-io/open-design",46637,5311,2026-04-28,"🎨 Local-first, open-source alternative to Anthropic's Claude Design. ⚡ 19 Skills · ✨ 71 brand-grade Design Systems 🖼 Generate web · desktop · mobile prototypes · slides · images · videos · HyperFrames 📦 Sandboxed preview · HTML/PDF/PPTX/MP4 export 🤖 Runs on Claude Code / Codex / Cursor / Gemini / OpenCode / Qwen / Copilot / Hermes / Kimi CLI.","https://github.com/nexu-io/open-design"
"santifer/career-ops",46132,9662,2026-04-04,"AI-powered job search system built on Claude Code. 14 skill modes, Go dashboard, PDF generation, batch processing.","https://github.com/santifer/career-ops"
"addyosmani/agent-skills",43856,4831,2026-02-15,"Production-grade engineering skills for AI coding agents.","https://github.com/addyosmani/agent-skills"
"HKUDS/nanobot",42793,7534,2026-02-01,"Lightweight, open-source AI agent for your tools, chats, and workflows.","https://github.com/HKUDS/nanobot"
"sickn33/antigravity-awesome-skills",38039,6218,2026-01-14,"Installable GitHub library of 1,400+ agentic skills for Claude Code, Cursor, Codex CLI, Gemini CLI, Antigravity, and more. Includes installer CLI, bundles, workflows, and official/community skill collections.","https://github.com/sickn33/antigravity-awesome-skills"
"ZhuLinsen/daily_stock_analysis",37799,36520,2026-01-10,"LLM驱动的 A/H/美股智能分析：多数据源行情 + 实时新闻 + LLM决策仪表盘 + 多渠道推送，零成本定时运行，纯白嫖. LLM-powered stock analysis system for A/H/US markets.","https://github.com/ZhuLinsen/daily_stock_analysis"
"HKUDS/CLI-Anything",37682,3608,2026-03-08,"""CLI-Anything: Making ALL Software Agent-Native"" -- CLI-Hub: https://clianything.cc/","https://github.com/HKUDS/CLI-Anything"
"Yeachan-Heo/oh-my-claudecode",34291,3144,2026-01-09,"Teams-first Multi-agent orchestration for Claude Code","https://github.com/Yeachan-Heo/oh-my-claudecode"
"vercel-labs/agent-browser",33538,2092,2026-01-11,"Browser automation CLI for AI agents","https://github.com/vercel-labs/agent-browser"
"Hmbown/DeepSeek-TUI",32417,2762,2026-01-19,"Coding agent for DeepSeek models that runs in your terminal","https://github.com/Hmbown/DeepSeek-TUI"
"kepano/obsidian-skills",32109,2232,2026-01-02,"Agent skills for Obsidian. Teach your agent to use Markdown, Bases, JSON Canvas, and use the CLI.","https://github.com/kepano/obsidian-skills"
"zeroclaw-labs/zeroclaw",31461,4629,2026-02-13,"Fast, small, and fully autonomous AI personal assistant infrastructure, ANY OS, ANY PLATFORM — deploy anywhere, swap anything 🦀","https://github.com/zeroclaw-labs/zeroclaw"
"hesamsheikh/awesome-openclaw-usecases",31120,2679,2026-02-08,"A community collection of OpenClaw use cases for making life easier.","https://github.com/hesamsheikh/awesome-openclaw-usecases"
"coreyhaines31/marketingskills",29552,4828,2026-01-15,"Marketing skills for Claude Code and AI agents. CRO, copywriting, SEO, analytics, and growth engineering.","https://github.com/coreyhaines31/marketingskills"
"multica-ai/multica",29542,3602,2026-01-13,"The open-source managed agents platform. Turn coding agents into real teammates — assign tasks, track progress, compound skills.","https://github.com/multica-ai/multica"
"lbjlaq/Antigravity-Manager",29135,3180,2025-11-26,"Professional Antigravity Account Manager & Switcher. One-click seamless account switching for Antigravity Tools. Built with Tauri v2 + React (Rust).专业的 Antigravity 账号管理与切换工具。为 Antigravity 提供一键无缝账号切换功能。","https://github.com/lbjlaq/Antigravity-Manager"
"sipeed/picoclaw",29100,4166,2026-02-04,"Tiny, Fast, and Deployable anywhere — automate the mundane, unleash your creativity","https://github.com/sipeed/picoclaw"
"Yeachan-Heo/oh-my-codex",29071,2318,2026-02-02,"OmX - Oh My codeX: Your codex is not alone. Add hooks, agent teams, HUDs, and so much more.","https://github.com/Yeachan-Heo/oh-my-codex"
"nanocoai/nanoclaw",29059,12830,2026-01-31,"A lightweight alternative to OpenClaw that runs in containers for security. Connects to WhatsApp, Telegram, Slack, Discord, Gmail and other messaging apps,, has memory, scheduled jobs, and runs directly on Anthropic's Agents SDK","https://github.com/nanocoai/nanoclaw"
"Gitlawb/openclaude",27173,8510,2026-04-01,"runs anywhere. uses anything","https://github.com/Gitlawb/openclaude"
"jamiepine/voicebox",26961,3263,2026-01-25,"The open-source AI voice studio. Clone, dictate, create.","https://github.com/jamiepine/voicebox"
"vercel-labs/agent-skills",26829,2441,2025-12-08,"Vercel's official collection of agent skills","https://github.com/vercel-labs/agent-skills"
"googleworkspace/cli",26421,1379,2026-03-02,"Google Workspace CLI — one command-line tool for Drive, Gmail, Calendar, Sheets, Docs, Chat, Admin, and more. Dynamically built from Google Discovery Service. Includes AI agent skills.","https://github.com/googleworkspace/cli"
"AlexsJones/llmfit",26420,1580,2026-02-15,"Hundreds of models & providers. One command to find what runs on your hardware.","https://github.com/AlexsJones/llmfit"
"Alishahryar1/free-claude-code",26355,3928,2026-01-28,"Use claude-code for free in the terminal, VSCode extension or discord like OpenClaw (voice supported)","https://github.com/Alishahryar1/free-claude-code"
"mvanhorn/last30days-skill",26188,2224,2026-01-23,"AI agent skill that researches any topic across Reddit, X, YouTube, HN, Polymarket, and the web - then synthesizes a grounded summary","https://github.com/mvanhorn/last30days-skill"
"anthropics/financial-services",25918,3600,2026-02-23,"","https://github.com/anthropics/financial-services"
"xai-org/x-algorithm",25463,4364,2026-01-19,"Algorithm powering the For You feed on X","https://github.com/xai-org/x-algorithm"
"zai-org/Open-AutoGLM",25321,3955,2025-12-08,"An Open Phone Agent Model & Framework. Unlocking the AI Phone for Everyone","https://github.com/zai-org/Open-AutoGLM"
"tobi/qmd",25160,1586,2025-12-08,"mini cli search engine for your docs, knowledge bases, meeting notes, whatever. Tracking current sota approaches while being all local","https://github.com/tobi/qmd"
"Leey21/awesome-ai-research-writing",24301,1940,2026-01-30,"Elevate your AI research writing, no more tedious polishing ✨ ","https://github.com/Leey21/awesome-ai-research-writing"
"openai/symphony",24263,2370,2026-02-26,"Symphony turns project work into isolated, autonomous implementation runs, allowing teams to manage work instead of supervising coding agents.","https://github.com/openai/symphony"
"volcengine/OpenViking",24188,1808,2026-01-05,"OpenViking is an open-source context database designed specifically for AI Agents(such as openclaw). OpenViking unifies the management of context (memory, resources, and skills) that Agents need through a file system paradigm, enabling hierarchical context delivery and self-evolving.","https://github.com/volcengine/OpenViking"
"HKUDS/DeepTutor",24118,3221,2025-12-28,"""DeepTutor: Agent-Native Personalized Learning Assistant""","https://github.com/HKUDS/DeepTutor"
"jarrodwatts/claude-hud",23231,1048,2026-01-02,"A Claude Code plugin that shows what's happening - context usage, active tools, running agents, and todo progress","https://github.com/jarrodwatts/claude-hud"
"Wei-Shaw/sub2api",21986,4161,2025-12-18,"Sub2API-CRS2 一站式开源中转服务，让 Claude、Openai 、Gemini、Antigravity订阅统一接入，支持拼车共享，更高效分摊成本，原生工具无缝使用。","https://github.com/Wei-Shaw/sub2api"
"jackwener/OpenCLI",21893,2206,2026-03-14,"Make Any Website into CLI & Use your logged-in browser by AI agent. ","https://github.com/jackwener/OpenCLI"
"OthmanAdi/planning-with-files",21686,1916,2026-01-03,"Claude Code skill implementing Manus-style persistent markdown planning — the workflow pattern behind the $2B acquisition.","https://github.com/OthmanAdi/planning-with-files"
"tinyhumansai/openhuman",21136,1858,2026-02-18,"Your Personal AI super intelligence. Private, Simple and extremely powerful.","https://github.com/tinyhumansai/openhuman"
"2025Emma/vibe-coding-cn",21015,2276,2025-12-17,"","https://github.com/2025Emma/vibe-coding-cn"
"NVIDIA/NemoClaw",20549,2697,2026-03-15,"Run OpenClaw more securely inside NVIDIA OpenShell with managed inference","https://github.com/NVIDIA/NemoClaw"
"NawfalMotii79/PLFM_RADAR",20329,4835,2026-03-08,"Open-source, low-cost 10.5 GHz PLFM phased array RADAR system","https://github.com/NawfalMotii79/PLFM_RADAR"
"alchaincyf/nuwa-skill",19926,3090,2026-04-05,"你想蒸馏的下一个员工，何必是同事。蒸馏任何人的思维方式——心智模型、决策启发式、表达DNA。Distill how anyone thinks.","https://github.com/alchaincyf/nuwa-skill"
"Panniantong/Agent-Reach",19902,1765,2026-02-24,"Give your AI agent eyes to see the entire internet. Read & search Twitter, Reddit, YouTube, GitHub, Bilibili, XiaoHongShu — one CLI, zero API fees.","https://github.com/Panniantong/Agent-Reach"
"blader/humanizer",19817,1883,2026-01-18,"Claude Code skill that removes signs of AI-generated writing from text","https://github.com/blader/humanizer"
"heygen-com/hyperframes",19696,1855,2026-03-10,"Write HTML. Render video. Built for agents.","https://github.com/heygen-com/hyperframes"
"openai/skills",19599,1300,2025-11-25,"Skills Catalog for Codex","https://github.com/openai/skills"
"vercel-labs/skills",19292,1559,2026-01-14,"The open agent skills tool - npx skills","https://github.com/vercel-labs/skills"
"Donchitos/Claude-Code-Game-Studios",19289,2819,2026-02-12,"Turn Claude Code into a full game dev studio — 49 AI agents, 72 workflow skills, and a complete coordination system mirroring real studio hierarchy.","https://github.com/Donchitos/Claude-Code-Game-Studios"
"snarktank/ralph",19268,1919,2026-01-07,"Ralph is an autonomous AI agent loop that runs repeatedly until all PRD items are complete. ","https://github.com/snarktank/ralph"
"openai/codex-plugin-cc",19104,1136,2026-03-30,"Use Codex from Claude Code to review code or delegate tasks.","https://github.com/openai/codex-plugin-cc"
"karpathy/llm-council",18940,3643,2025-11-22,"LLM Council works together to answer your hardest questions","https://github.com/karpathy/llm-council"
"agentskills/agentskills",18928,1151,2025-12-16,"Specification and documentation for Agent Skills","https://github.com/agentskills/agentskills"
"JimLiu/baoyu-skills",18850,2213,2026-01-13,"","https://github.com/JimLiu/baoyu-skills"
"hugohe3/ppt-master",18602,1764,2025-12-10,"AI generates natively editable PPTX from any document — real PowerPoint shapes with native animations, not images · by Hugo He","https://github.com/hugohe3/ppt-master"
"claude-code-best/claude-code",18505,15863,2026-03-31,"原汁原昧 Claude Code 可运行,可构建, 可调试版; 生产级工程化, 企业级可靠性; 安全无毒, 内存泄露修复","https://github.com/claude-code-best/claude-code"
"Leonxlnx/taste-skill",18208,1556,2026-02-19,"Taste-Skill - gives your AI good taste. stops the AI from generating boring, generic slop ","https://github.com/Leonxlnx/taste-skill"
"titanwings/colleague-skill",18200,1821,2026-03-30,"将冰冷的离别化为温暖的 Skill，欢迎加入数字生命1.0！Transforming cold farewells into warm skills? It's giving rebirth era. Welcome to Digital Life 1.0. 🫶","https://github.com/titanwings/colleague-skill"
"zarazhangrui/frontend-slides",18177,1497,2026-01-28,"Create beautiful slides on the web using Claude's frontend skills","https://github.com/zarazhangrui/frontend-slides"
"THU-MAIC/OpenMAIC",17719,3422,2026-03-11,"Open Multi-Agent Interactive Classroom — Get an immersive, multi-agent learning experience in just one click","https://github.com/THU-MAIC/OpenMAIC"
"RightNow-AI/openfang",17582,2255,2026-02-24,"Open-source Agent Operating System","https://github.com/RightNow-AI/openfang"
"garrytan/gbrain",17523,2409,2026-04-05,"Garry's Opinionated OpenClaw/Hermes Agent Brain","https://github.com/garrytan/gbrain"
"tanweai/pua",17497,1027,2026-03-08,"你是一个曾经被寄予厚望的 P8 级工程师。Anthropic 当初给你定级的时候，对你的期望是很高的。  一个agent使用的高能动性的skill。  Your AI has been placed on a PIP. 30 days to show improvement.","https://github.com/tanweai/pua"
"manaflow-ai/cmux",17440,1366,2026-01-28,"Ghostty-based macOS terminal with vertical tabs and notifications for AI coding agents","https://github.com/manaflow-ai/cmux"
"pranshuparmar/witr",17108,525,2025-12-20,"Why is this running?","https://github.com/pranshuparmar/witr"
"tirth8205/code-review-graph",16907,1833,2026-02-26,"Local knowledge graph for Claude Code. Builds a persistent map of your codebase so Claude reads only what matters — 6.8× fewer tokens on reviews and up to 49× on daily coding tasks.","https://github.com/tirth8205/code-review-graph"
"agentscope-ai/QwenPaw",16800,2429,2026-02-24,"Your Personal AI Assistant; easy to install, deploy on your own machine or on the cloud; supports multiple chat apps with easily extensible capabilities.","https://github.com/agentscope-ai/QwenPaw"
"CloakHQ/CloakBrowser",16557,1279,2026-02-22,"Stealth Chromium that passes every bot detection test. Drop-in Playwright replacement with source-level fingerprint patches. 30/30 tests passed.","https://github.com/CloakHQ/CloakBrowser"
"cft0808/edict",15807,1671,2026-02-23,"🏛️ 三省六部制 · OpenClaw Multi-Agent Orchestration System — 9 specialized AI agents with real-time dashboard, model config, and full audit trails","https://github.com/cft0808/edict"
"muratcankoylan/Agent-Skills-for-Context-Engineering",15789,1268,2025-12-21,"A comprehensive collection of Agent Skills for context engineering, multi-agent architectures, and production agent systems. Use when building, optimizing, or debugging agent systems that require effective context management.","https://github.com/muratcankoylan/Agent-Skills-for-Context-Engineering"
"gastownhall/gastown",15389,1430,2025-12-16,"Gas Town - multi-agent workspace manager","https://github.com/gastownhall/gastown"
"different-ai/openwork",15358,1510,2026-01-14,"An open-source alternative to Claude Cowork (powered by opencode)","https://github.com/different-ai/openwork"
"Lum1104/Understand-Anything",15252,1450,2026-03-15,"Graphs that teach > graphs that impress. Turn any code, or knowledge base (Karpathy LLM wiki), into an interactive knowledge graph you can explore, search, and ask questions about. Works with Claude Code, Codex, Cursor, Copilot, Gemini CLI, and more.","https://github.com/Lum1104/Understand-Anything"
"mksglu/context-mode",15176,1089,2026-02-23,"Context window optimization for AI coding agents. Sandboxes tool output, 98% reduction. 15 platforms","https://github.com/mksglu/context-mode"
"JCodesMore/ai-website-cloner-template",15094,2316,2026-03-13,"Clone any website with one command using AI coding agents","https://github.com/JCodesMore/ai-website-cloner-template"
"EvoLinkAI/awesome-gpt-image-2-API-and-Prompts",15038,1519,2026-04-18,"GPT-Image-2 API and Prompts","https://github.com/EvoLinkAI/awesome-gpt-image-2-API-and-Prompts"
"vercel-labs/json-render",14848,798,2026-01-14,"The Generative UI framework","https://github.com/vercel-labs/json-render"
"jundot/omlx",14614,1225,2026-02-13,"LLM inference server with continuous batching & SSD caching for Apple Silicon — managed from the macOS menu bar","https://github.com/jundot/omlx"
"Anionex/banana-slides",14605,1719,2025-11-29,"一个基于nano banana pro🍌的原生AI PPT生成应用，迈向真正的＂Vibe PPT＂; 支持上传任意模板图片；上传任意素材&智能解析；一句话/大纲/页面描述自动生成PPT；口头修改指定区域、一键导出可编辑ppt - An AI-native slides generator based on nano banana pro🍌","https://github.com/Anionex/banana-slides"
"webadderallorg/Recordly",14426,1027,2026-03-12,"Create polished screen recordings without editing. Mac/Windows/Linux","https://github.com/webadderallorg/Recordly"
"NousResearch/hermes-agent",157986,25546,2025-07-22,"The agent that grows with you","https://github.com/NousResearch/hermes-agent"
"anthropics/skills",137626,16233,2025-09-22,"Public repository for Agent Skills","https://github.com/anthropics/skills"
"msitarzewski/agency-agents",101569,16792,2025-10-13,"A complete AI agency at your fingertips - From frontend wizards to Reddit community ninjas, from whimsy injectors to reality checkers. Each agent is a specialized expert with personality, processes, and proven deliverables.","https://github.com/msitarzewski/agency-agents"
"thedotmack/claude-mem",76852,6616,2025-08-31,"Persistent Context Across Sessions for Every Agent –  Captures everything your agent does during sessions, compresses it with AI, and injects relevant context back into future sessions. Works with Claude Code, OpenClaw, Codex, Gemini, Hermes, Copilot, OpenCode + More","https://github.com/thedotmack/claude-mem"
"farion1231/cc-switch",75540,4904,2025-08-04,"A cross-platform desktop All-in-One assistant for Claude Code, Codex, OpenCode, OpenClaw, Gemini CLI & Hermes Agent. Only official website: ccswitch.io","https://github.com/farion1231/cc-switch"
"shareAI-lab/learn-claude-code",61365,10033,2025-06-29,"Bash is all you need -  A nano claude code–like 「agent harness」, built from 0 to 1","https://github.com/shareAI-lab/learn-claude-code"
"ruvnet/RuView",60841,7938,2025-06-07,"π RuView turns commodity WiFi signals into real-time spatial intelligence, vital sign monitoring, and presence detection — all without a single pixel of video.","https://github.com/ruvnet/RuView"
"karpathy/nanochat",53694,7230,2025-10-13,"The best ChatGPT that $100 can buy.","https://github.com/karpathy/nanochat"
"earendil-works/pi",51721,6158,2025-08-09,"AI agent toolkit: coding agent CLI, unified LLM API, TUI & web UI libraries, Slack bot, vLLM pods","https://github.com/earendil-works/pi"
"OpenCut-app/OpenCut",51498,5574,2025-06-22,"The open-source CapCut alternative","https://github.com/OpenCut-app/OpenCut"
"datawhalechina/hello-agents",51411,6216,2025-09-07,"📚 《从零开始构建智能体》——从零开始的智能体原理与实践教程","https://github.com/datawhalechina/hello-agents"
"microsoft/VibeVoice",47304,5271,2025-08-25,"Open-Source Frontier Voice AI","https://github.com/microsoft/VibeVoice"
