"name","stars","forks","created_at","summary","url"
"khwarij/DBD-AutoGrind-Trainer-2026-Mega",193,0,2026-06-28,"Ultimate Dead by Daylight auto-grind trainer Mega edition with Bloodpoint bot, ESP wallhack, aimbot, and full perk/skin unlocker. Dominate the Fog with our 2026 undetected external tool.","https://github.com/khwarij/DBD-AutoGrind-Trainer-2026-Mega"
"alex-carneiro/DBD-AutoGrind-Trainer-2026-Elite",193,0,2026-06-28,"Ultimate Dead by Daylight auto-grind trainer Elite edition with Bloodpoint bot, ESP wallhack, aimbot, and full perk/skin unlocker. Dominate the Fog with our 2026 undetected external tool.","https://github.com/alex-carneiro/DBD-AutoGrind-Trainer-2026-Elite"
"AdilMir1433/DBD-AutoGrind-Trainer-2026-Max",193,0,2026-06-28,"Ultimate Dead by Daylight auto-grind trainer Max edition with Bloodpoint bot, ESP wallhack, aimbot, and full perk/skin unlocker. Dominate the Fog with our 2026 undetected external tool.","https://github.com/AdilMir1433/DBD-AutoGrind-Trainer-2026-Max"
"AdilMir1433/DBD-AutoGrind-Trainer-2026-Elite",193,0,2026-06-28,"Ultimate Dead by Daylight auto-grind trainer Elite edition with Bloodpoint bot, ESP wallhack, aimbot, and full perk/skin unlocker. Dominate the Fog with our 2026 undetected external tool.","https://github.com/AdilMir1433/DBD-AutoGrind-Trainer-2026-Elite"
"Selva-rc/DBD-AutoGrind-Trainer-2026-Elite",193,0,2026-06-28,"Ultimate Dead by Daylight auto-grind trainer Elite edition with Bloodpoint bot, ESP wallhack, aimbot, and full perk/skin unlocker. Dominate the Fog with our 2026 undetected external tool.","https://github.com/Selva-rc/DBD-AutoGrind-Trainer-2026-Elite"
"affaan-m/ECC",223488,34216,2026-01-18,"The agent harness performance optimization system. Skills, instincts, memory, security, and research-first development for Claude Code, Codex, Opencode, Cursor and beyond.","https://github.com/affaan-m/ECC"
"ultraworkers/claw-code",194451,109867,2026-03-31,"An agent-managed museum exhibit, built in Rust with Gajae-Code / LazyCodex — developed and maintained with no human intervention.","https://github.com/ultraworkers/claw-code"
"multica-ai/andrej-karpathy-skills",184605,18925,2026-01-27,"A single CLAUDE.md file to improve Claude Code behavior, derived from Andrej Karpathy's observations on LLM coding pitfalls.","https://github.com/multica-ai/andrej-karpathy-skills"
"mattpocock/skills",150507,13010,2026-02-03,"Skills for Real Engineers. Straight from my .claude directory.","https://github.com/mattpocock/skills"
"garrytan/gstack",118099,17573,2026-03-11,"Use Garry Tan's exact Claude Code setup: 23 opinionated tools that serve as CEO, Designer, Eng Manager, Release Manager, Doc Engineer, and QA","https://github.com/garrytan/gstack"
"VoltAgent/awesome-design-md",94317,11174,2026-03-31,"A collection of DESIGN.md files analysis by popular brand design systems. Drop one into your project and let coding agents generate a matching UI.","https://github.com/VoltAgent/awesome-design-md"
"karpathy/autoresearch",89153,12887,2026-03-06,"AI agents running research on single-GPU nanochat training automatically","https://github.com/karpathy/autoresearch"
"pewdiepie-archdaemon/odysseus",79334,10362,2026-05-31,"Self-hosted AI workspace. ","https://github.com/pewdiepie-archdaemon/odysseus"
"JuliusBrussee/caveman",77980,4410,2026-04-04,"🪨 why use many token when few token do trick — Claude Code skill that cuts 65% of tokens by talking like caveman","https://github.com/JuliusBrussee/caveman"
"safishamsi/graphify",74372,7403,2026-04-03,"AI coding assistant skill (Claude Code, Codex, OpenCode, Cursor, Gemini CLI, and more). Turn any folder of code, SQL schemas, R scripts, shell scripts, docs, papers, images, or videos into a queryable knowledge graph. App code + database schema + infrastructure in one graph.","https://github.com/safishamsi/graphify"
"paperclipai/paperclip",72188,13443,2026-03-02,"The open-source app everyone uses to manage agents at work","https://github.com/paperclipai/paperclip"
"Egonex-AI/Understand-Anything",69220,5724,2026-03-15,"Graphs that teach > graphs that impress. Turn any code into an interactive knowledge graph you can explore, search, and ask questions about. Works with Claude Code, Codex, Cursor, Copilot, Gemini CLI, and more.","https://github.com/Egonex-AI/Understand-Anything"
"addyosmani/agent-skills",67954,7376,2026-02-15,"Production-grade engineering skills for AI coding agents.","https://github.com/addyosmani/agent-skills"
"DietrichGebert/ponytail",67221,3460,2026-06-12,"Makes your AI agent think like the laziest senior dev in the room. The best code is the code you never wrote.","https://github.com/DietrichGebert/ponytail"
"rtk-ai/rtk",67043,4141,2026-01-22,"CLI proxy that reduces LLM token consumption by 60-90% on common dev commands. Single Rust binary, zero dependencies","https://github.com/rtk-ai/rtk"
"koala73/worldmonitor",60923,9483,2026-01-08,"Real-time global intelligence dashboard. AI-powered news aggregation, geopolitical monitoring, and infrastructure tracking in a unified situational awareness interface","https://github.com/koala73/worldmonitor"
"santifer/career-ops",56653,11193,2026-04-04,"AI-powered job search system built on Claude Code. 14 skill modes, Go dashboard, PDF generation, batch processing.","https://github.com/santifer/career-ops"
"colbymchenry/codegraph",56042,3457,2026-01-18,"Pre-indexed code knowledge graph, auto syncs on code changes, for Claude Code, Codex, Gemini, Cursor, OpenCode, AntiGravity, Kiro, and Hermes Agent — fewer tokens, fewer tool calls, 100% local","https://github.com/colbymchenry/codegraph"
"headroomlabs-ai/headroom",53884,3868,2026-01-07,"Compress tool outputs, logs, files, and RAG chunks before they reach the LLM. 60-95% fewer tokens, same answers. Library, proxy, MCP server.","https://github.com/headroomlabs-ai/headroom"
"Leonxlnx/taste-skill",53254,3667,2026-02-19,"Taste-Skill - gives your AI good taste. stops the AI from generating boring, generic slop ","https://github.com/Leonxlnx/taste-skill"
"ZhuLinsen/daily_stock_analysis",51805,44982,2026-01-10,"LLM 驱动的多市场股票智能分析系统：多源行情、实时新闻、决策看板与自动推送，支持零成本定时运行。  LLM-powered multi-market stock analysis system with multi-source market data, real-time news, decision dashboard, automated notifications, and cost-free scheduled runs.","https://github.com/ZhuLinsen/daily_stock_analysis"
"VoltAgent/awesome-openclaw-skills",50756,4915,2026-01-25,"The awesome collection of OpenClaw skills. 5,400+ skills filtered and categorized from the official OpenClaw Skills Registry.🦞","https://github.com/VoltAgent/awesome-openclaw-skills"
"Panniantong/Agent-Reach",45722,3624,2026-02-24,"Give your AI agent eyes to see the entire internet. Read & search Twitter, Reddit, YouTube, GitHub, Bilibili, XiaoHongShu — one CLI, zero API fees.","https://github.com/Panniantong/Agent-Reach"
"HKUDS/nanobot",44858,7911,2026-02-01,"Lightweight, open-source AI agent for your tools, chats, and workflows.","https://github.com/HKUDS/nanobot"
"HKUDS/CLI-Anything",44256,4133,2026-03-08,"""CLI-Anything: Making ALL Software Agent-Native"" -- CLI-Hub: https://clianything.cc/","https://github.com/HKUDS/CLI-Anything"
"sickn33/antigravity-awesome-skills",42028,6719,2026-01-14,"Installable GitHub library of 1,600+ agentic skills for Claude Code, Cursor, Codex CLI, Gemini CLI, Antigravity, and more. Includes specialized plugins, installer CLI, bundles, workflows, and official/community skill collections.","https://github.com/sickn33/antigravity-awesome-skills"
"Hmbown/CodeWhale",39190,3380,2026-01-19,"Open-source, community-driven agent harness","https://github.com/Hmbown/CodeWhale"
"kepano/obsidian-skills",38901,2761,2026-01-02,"Agent skills for Obsidian. Teach your agent to use Obsidian CLI and open formats including Markdown, Bases, JSON Canvas.","https://github.com/kepano/obsidian-skills"
"multica-ai/multica",38449,4800,2026-01-13,"The open-source managed agents platform. Turn coding agents into real teammates — assign tasks, track progress, compound skills.","https://github.com/multica-ai/multica"
"Alishahryar1/free-claude-code",37691,5920,2026-01-28,"Use claude code and codex for free in the terminal, VSCode extension, and discord like OpenClaw (voice supported)","https://github.com/Alishahryar1/free-claude-code"
"vercel-labs/agent-browser",37504,2408,2026-01-11,"Browser automation CLI for AI agents","https://github.com/vercel-labs/agent-browser"
"Yeachan-Heo/oh-my-claudecode",37167,3361,2026-01-09,"Teams-first Multi-agent orchestration for Claude Code","https://github.com/Yeachan-Heo/oh-my-claudecode"
"rohitg00/ai-engineering-from-scratch",36831,6079,2026-03-18,"Learn it. Build it. Ship it for others.","https://github.com/rohitg00/ai-engineering-from-scratch"
"coreyhaines31/marketingskills",35474,5784,2026-01-15,"Marketing skills for Claude Code and AI agents. CRO, copywriting, SEO, analytics, and growth engineering.","https://github.com/coreyhaines31/marketingskills"
"tinyhumansai/openhuman",33872,3279,2026-02-18,"Your Personal AI super intelligence. Private, Simple and extremely powerful.","https://github.com/tinyhumansai/openhuman"
"heygen-com/hyperframes",32173,2991,2026-03-10,"Write HTML. Render video. Built for agents.","https://github.com/heygen-com/hyperframes"
"zeroclaw-labs/zeroclaw",32093,4770,2026-02-13,"Fast, small, and fully autonomous AI personal assistant infrastructure, any OS, any platform — deploy anywhere, swap anything 🦀","https://github.com/zeroclaw-labs/zeroclaw"
"Yeachan-Heo/oh-my-codex",31501,2460,2026-02-02,"OmX - Oh My codeX: Your codex is not alone. Add hooks, agent teams, HUDs, and so much more.","https://github.com/Yeachan-Heo/oh-my-codex"
"hesamsheikh/awesome-openclaw-usecases",31452,2702,2026-02-08,"A community collection of OpenClaw use cases for making life easier.","https://github.com/hesamsheikh/awesome-openclaw-usecases"
"nanocoai/nanoclaw",30042,12898,2026-01-31,"A lightweight alternative to OpenClaw that runs in containers for security. Connects to WhatsApp, Telegram, Slack, Discord, Gmail and other messaging apps,, has memory, scheduled jobs, and runs directly on Anthropic's Agents SDK","https://github.com/nanocoai/nanoclaw"
"Leey21/awesome-ai-research-writing",29990,2290,2026-01-30,"Elevate your AI research writing, no more tedious polishing ✨ ","https://github.com/Leey21/awesome-ai-research-writing"
"sipeed/picoclaw",29529,4254,2026-02-04,"Tiny, Fast, and Deployable anywhere — automate the mundane, unleash your creativity","https://github.com/sipeed/picoclaw"
"Gitlawb/openclaude",29525,8835,2026-04-01,"runs anywhere. uses anything","https://github.com/Gitlawb/openclaude"
"calesthio/OpenMontage",28523,3180,2026-03-29,"World's first open-source, agentic video production system. 12 pipelines, 52 tools, 500+ agent skills. Turn your AI coding assistant into a full video production studio.","https://github.com/calesthio/OpenMontage"
"CloakHQ/CloakBrowser",27416,2183,2026-02-22,"Stealth Chromium that passes every bot detection test. Drop-in Playwright replacement with source-level fingerprint patches. 30/30 tests passed.","https://github.com/CloakHQ/CloakBrowser"
"blader/humanizer",26771,2495,2026-01-18,"Claude Code skill that removes signs of AI-generated writing from text","https://github.com/blader/humanizer"
"xai-org/x-algorithm",26331,4505,2026-01-19,"Algorithm powering the For You feed on X","https://github.com/xai-org/x-algorithm"
"alchaincyf/nuwa-skill",26249,3763,2026-04-05,"你想蒸馏的下一个员工，何必是同事。蒸馏任何人的思维方式——心智模型、决策启发式、表达DNA。Distill how anyone thinks.","https://github.com/alchaincyf/nuwa-skill"
"jarrodwatts/claude-hud",25928,1182,2026-01-02,"A Claude Code plugin that shows what's happening - context usage, active tools, running agents, and todo progress","https://github.com/jarrodwatts/claude-hud"
"openai/symphony",25680,2602,2026-02-26,"Symphony turns project work into isolated, autonomous implementation runs, allowing teams to manage work instead of supervising coding agents.","https://github.com/openai/symphony"
"jackwener/OpenCLI",25617,2545,2026-03-14,"Make Any Website into CLI & Use your logged-in browser by AI agent. ","https://github.com/jackwener/OpenCLI"
"garrytan/gbrain",24546,3537,2026-04-05,"Garry's Opinionated OpenClaw/Hermes Agent Brain","https://github.com/garrytan/gbrain"
"vercel-labs/skills",24334,2001,2026-01-14,"The open agent skills tool - npx skills","https://github.com/vercel-labs/skills"
"Yuan1z0825/nature-skills",24311,1463,2026-04-24,"符合nature论文学术表达和科研绘图的Skill","https://github.com/Yuan1z0825/nature-skills"
"rohitg00/agentmemory",24303,1995,2026-02-25,"#1 Persistent memory for AI coding agents based on real-world benchmarks","https://github.com/rohitg00/agentmemory"
"JCodesMore/ai-website-cloner-template",23475,3344,2026-03-13,"Clone any website with one command using AI coding agents","https://github.com/JCodesMore/ai-website-cloner-template"
"manaflow-ai/cmux",23153,1831,2026-01-28,"Open source Ghostty-based macOS terminal with vertical tabs and notifications for AI coding agents. Built for multitasking, organization, and programmability.","https://github.com/manaflow-ai/cmux"
"mukul975/Anthropic-Cybersecurity-Skills",23075,2623,2026-02-25,"817 structured cybersecurity skills for AI agents · Mapped to 6 frameworks: MITRE ATT&CK, NIST CSF 2.0, MITRE ATLAS, D3FEND, NIST AI RMF & MITRE F3 (Fight Fraud) · agentskills.io standard · Works with Claude Code, GitHub Copilot, Codex CLI, Cursor, Gemini CLI & 20+ platforms · 29 security domains · Apache 2.0","https://github.com/mukul975/Anthropic-Cybersecurity-Skills"
"JimLiu/baoyu-skills",22768,2584,2026-01-13,"","https://github.com/JimLiu/baoyu-skills"
"BigPizzaV3/CodexPlusPlus",22473,1427,2026-05-06,"An enhanced tool for CodexApp, striving to make Codex better to use and more comfortable 一个CodexApp的增强工具，努力让Codex变得更好用更舒服","https://github.com/BigPizzaV3/CodexPlusPlus"
"Donchitos/Claude-Code-Game-Studios",22450,3243,2026-02-12,"Turn Claude Code into a full game dev studio — 49 AI agents, 72 workflow skills, and a complete coordination system mirroring real studio hierarchy.","https://github.com/Donchitos/Claude-Code-Game-Studios"
"anthropics/knowledge-work-plugins",22176,2596,2026-01-23,"Open source repository of plugins primarily intended for knowledge workers to use in Claude Cowork","https://github.com/anthropics/knowledge-work-plugins"
"NawfalMotii79/PLFM_RADAR",22085,5180,2026-03-08,"Open-source, low-cost 10.5 GHz PLFM phased array RADAR system","https://github.com/NawfalMotii79/PLFM_RADAR"
"openai/codex-plugin-cc",21860,1332,2026-03-30,"Use Codex from Claude Code to review code or delegate tasks.","https://github.com/openai/codex-plugin-cc"
"phuryn/pm-skills",21707,2192,2026-03-01,"PM Skills Marketplace: 100+ agentic skills, commands, and plugins — from discovery to strategy, execution, launch, and growth.","https://github.com/phuryn/pm-skills"
"DeusData/codebase-memory-mcp",21417,1538,2026-02-24,"High-performance code intelligence MCP server. Indexes codebases into a persistent knowledge graph — average repo in milliseconds. 158 languages, sub-ms queries, 99% fewer tokens. Single static binary, zero dependencies.","https://github.com/DeusData/codebase-memory-mcp"
"snarktank/ralph",20711,2027,2026-01-07,"Ralph is an autonomous AI agent loop that runs repeatedly until all PRD items are complete. ","https://github.com/snarktank/ralph"
"claude-code-best/claude-code",20549,16295,2026-03-31,"原汁原昧 Claude Code 可运行,可构建, 可调试版; 生产级工程化, 企业级可靠性; 安全无毒, 内存泄露修复","https://github.com/claude-code-best/claude-code"
"alchaincyf/huashu-design",20293,2464,2026-04-19,"Huashu Design · HTML-native design skill for Claude Code · Claude Code 里 HTML 原生的设计 skill · 高保真原型 / 幻灯片 / 动画 + 20 设计哲学 + 5 维评审 + MP4 导出 · Agent-agnostic","https://github.com/alchaincyf/huashu-design"
"titanwings/colleague-skill",19923,1964,2026-03-30,"将冰冷的离别化为温暖的 Skill，欢迎加入数字生命1.0！Transforming cold farewells into warm skills? It's giving rebirth era. Welcome to Digital Life 1.0. 🫶","https://github.com/titanwings/colleague-skill"
"op7418/guizang-ppt-skill",19400,1416,2026-04-23,"AI-agent Skill for generating polished HTML slide decks: editorial magazine and Swiss layouts, image prompts, social covers, and a WebGL/low-power presentation runtime.","https://github.com/op7418/guizang-ppt-skill"
"THU-MAIC/OpenMAIC",19073,3755,2026-03-11,"Open Multi-Agent Interactive Classroom — Get an immersive, multi-agent learning experience in just one click","https://github.com/THU-MAIC/OpenMAIC"
"decolua/9router",18838,3049,2026-01-05,"Unlimited FREE AI coding. Connect Claude Code, Codex, Cursor, Cline, Copilot, Antigravity to FREE Claude/GPT/Gemini via 40+ providers. Auto-fallback, RTK -40% tokens, never hit limits.","https://github.com/decolua/9router"
"tanweai/pua",18515,1114,2026-03-08,"你是一个曾经被寄予厚望的 P8 级工程师。Anthropic 当初给你定级的时候，对你的期望是很高的。  一个agent使用的高能动性的skill。  Your AI has been placed on a PIP. 30 days to show improvement.","https://github.com/tanweai/pua"
"webadderallorg/Recordly",18364,1315,2026-03-12,"Create polished demo videos without editing skills. Mac/Windows/Linux","https://github.com/webadderallorg/Recordly"
"RightNow-AI/openfang",17947,2274,2026-02-24,"Open-source Agent Operating System","https://github.com/RightNow-AI/openfang"
"refactoringhq/tolaria",17499,1205,2026-02-14,"Desktop app to manage markdown knowledge bases","https://github.com/refactoringhq/tolaria"
"jundot/omlx",17269,1465,2026-02-13,"LLM inference server with continuous batching & SSD caching for Apple Silicon — managed from the macOS menu bar","https://github.com/jundot/omlx"
"teng-lin/notebooklm-py",16994,2309,2026-01-07,"Unofficial Python API and agentic skill for Google NotebookLM. Full programmatic access to NotebookLM's features—including capabilities the web UI doesn't expose—via Python, CLI, and AI agents like Claude Code, Codex, and OpenClaw.","https://github.com/teng-lin/notebooklm-py"
"antirez/ds4",16790,1434,2026-05-06,"DeepSeek 4 Flash and PRO local inference engine for Metal, CUDA and ROCm","https://github.com/antirez/ds4"
"different-ai/openwork",16491,1663,2026-01-14,"An open-source alternative to Claude Cowork (powered by opencode)","https://github.com/different-ai/openwork"
"h4ckf0r0day/obscura",16329,1131,2026-04-13,"The headless browser for AI agents and web scraping","https://github.com/h4ckf0r0day/obscura"
"KKKKhazix/khazix-skills",16181,1904,2026-04-06,"数字生命卡兹克开源的 AI Skills 合集","https://github.com/KKKKhazix/khazix-skills"
"cft0808/edict",16128,1698,2026-02-23,"🏛️ 三省六部制 · OpenClaw Multi-Agent Orchestration System — 9 specialized AI agents with real-time dashboard, model config, and full audit trails","https://github.com/cft0808/edict"
"jnMetaCode/agency-agents-zh",15973,2766,2026-03-06,"🎭 266 个即插即用的 AI 专家角色 — 支持 Hermes Agent/Claude Code/Cursor/Copilot 等 18 种工具，覆盖工程/设计/营销/金融等 20 个部门。含 50 个中国市场原创智能体（小红书/抖音/微信/飞书/钉钉等）。搭配编排器 agency-orchestrator，一句话即可让多位专家按 DAG 自动协作。","https://github.com/jnMetaCode/agency-agents-zh"
"browser-use/browser-harness",15513,1441,2026-04-17,"Browser Harness | Self-healing harness that enables LLMs to complete any task.","https://github.com/browser-use/browser-harness"
"larksuite/cli",14852,1023,2026-03-25,"The official Lark/Feishu CLI tool, maintained by the larksuite team — built for humans and AI Agents. Covers core business domains including Messenger, Docs, Base, Sheets, Calendar, Mail, Tasks, Meetings, and more, with 200+ commands and 20+ AI Agent Skills.","https://github.com/larksuite/cli"
"microsoft/RustTraining",14669,1149,2026-03-13,"Beginner, advanced, expert level Rust training material","https://github.com/microsoft/RustTraining"
"floci-io/floci",14567,1458,2026-02-18,"Light, fluffy, and always free - The AWS Local Emulator alternative","https://github.com/floci-io/floci"
"kyegomez/OpenMythos",14450,3248,2026-04-18,"A theoretical reconstruction of the Claude Mythos architecture, built from first principles using the available research literature.","https://github.com/kyegomez/OpenMythos"
"ComposioHQ/awesome-codex-skills",14335,1375,2026-01-12,"A curated list of practical Codex skills for automating workflows across the Codex CLI and API.","https://github.com/ComposioHQ/awesome-codex-skills"
"HKUDS/OpenHarness",14282,2353,2026-04-01,"""OpenHarness: Open Agent Harness with a Built-in Personal Agent--Ohmo!""","https://github.com/HKUDS/OpenHarness"
"google/skills",14275,1093,2026-03-31,"Agent Skills for Google products and technologies","https://github.com/google/skills"
"nikopueringer/CorridorKey",14263,867,2026-02-25,"Perfect Green Screen Keys","https://github.com/nikopueringer/CorridorKey"
"tashfeenahmed/freellmapi",14046,2087,2026-04-21,"OpenAI-compatible proxy that stacks the free tiers of 16 LLM providers (~1.7B tokens/month) behind one /v1 endpoint — plus any custom OpenAI-compatible endpoint. Smart routing, automatic failover, encrypted keys. Personal experimentation only.","https://github.com/tashfeenahmed/freellmapi"
"chenhg5/cc-connect",13266,1253,2026-02-28,"Bridge local AI coding agents (Claude Code, Cursor, Gemini CLI, Codex) to messaging platforms (Feishu/Lark, DingTalk, Slack, Telegram, Discord, LINE, WeChat Work). Chat with your AI dev assistant from anywhere — no public IP required for most platforms.","https://github.com/chenhg5/cc-connect"
"millionco/react-doctor",13209,420,2026-02-13,"Your agent writes bad React. This catches it","https://github.com/millionco/react-doctor"
"nashsu/llm_wiki",13193,1586,2026-04-08,"LLM Wiki is a cross-platform desktop application that turns your documents into an organized, interlinked knowledge base — automatically. Instead of traditional RAG (retrieve-and-answer from scratch every time), the LLM incrementally builds and maintains a persistent wiki from your sources。","https://github.com/nashsu/llm_wiki"
"lsdefine/GenericAgent",13189,1527,2026-01-16,"Self-evolving agent: grows skill tree from 3.3K-line seed, achieving full system control with 6x less token consumption","https://github.com/lsdefine/GenericAgent"
"chatfire-AI/huobao-drama",13078,2483,2026-01-05,"🎬 火宝短剧 - 基于AI的一站式短剧生成平台 《一句话生成完整短剧，从剧本到成片全自动化》  Huobao Drama - An AI-Powered End-to-End Short Drama Generator ""One Sentence to Complete Drama: Fully Automated from Script to Final Video""","https://github.com/chatfire-AI/huobao-drama"
"openclaw/openclaw",381016,79805,2025-11-24,"Your own personal AI assistant. Any OS. Any Platform. The lobster way. 🦞 ","https://github.com/openclaw/openclaw"
"obra/superpowers",241494,21445,2025-10-09,"An agentic skills framework & software development methodology that works.","https://github.com/obra/superpowers"
"anthropics/skills",156629,18448,2025-09-22,"Public repository for Agent Skills","https://github.com/anthropics/skills"
"msitarzewski/agency-agents",118844,19465,2025-10-13,"A complete AI agency at your fingertips - From frontend wizards to Reddit community ninjas, from whimsy injectors to reality checkers. Each agent is a specialized expert with personality, processes, and proven deliverables.","https://github.com/msitarzewski/agency-agents"
"github/spec-kit",116424,10284,2025-08-21,"💫 Toolkit to help you get started with Spec-Driven Development","https://github.com/github/spec-kit"
"farion1231/cc-switch",110624,7314,2025-08-04,"A cross-platform desktop All-in-One assistant for Claude Code, Codex, OpenCode, OpenClaw, Gemini CLI & Hermes Agent. Only official website: ccswitch.io","https://github.com/farion1231/cc-switch"
"nextlevelbuilder/ui-ux-pro-max-skill",98031,10326,2025-11-30,"An AI SKILL that provide design intelligence for building professional UI/UX multiple platforms","https://github.com/nextlevelbuilder/ui-ux-pro-max-skill"
"earendil-works/pi",66519,8128,2025-08-09,"AI agent toolkit: unified LLM API, agent loop, TUI, coding agent CLI","https://github.com/earendil-works/pi"
"ComposioHQ/awesome-claude-skills",66327,7376,2025-10-17,"A curated list of awesome Claude Skills, resources, and tools for customizing Claude AI workflows","https://github.com/ComposioHQ/awesome-claude-skills"
"gsd-build/get-shit-done",64577,5478,2025-12-14,"A light-weight and powerful meta-prompting, context engineering and spec-driven development system for Claude Code by TÂCHES.","https://github.com/gsd-build/get-shit-done"
"datawhalechina/hello-agents",62684,7752,2025-09-07,"📚 《从零开始构建智能体》——从零开始的智能体原理与实践教程","https://github.com/datawhalechina/hello-agents"
"shanraisshan/claude-code-best-practice",61570,6159,2025-10-31,"from vibe coding to agentic engineering - practice makes claude perfect","https://github.com/shanraisshan/claude-code-best-practice"
"Fission-AI/OpenSpec",57711,4022,2025-08-05,"Spec-driven development (SDD) for AI coding assistants.","https://github.com/Fission-AI/OpenSpec"
"karpathy/nanochat",55605,7652,2025-10-13,"The best ChatGPT that $100 can buy.","https://github.com/karpathy/nanochat"
"microsoft/VibeVoice",49745,5555,2025-08-25,"Open-Source Frontier Voice AI","https://github.com/microsoft/VibeVoice"
