"name","stars","forks","created_at","summary","url"
"KeygraphHQ/shannon",45266,5248,2025-09-27,"Shannon is an autonomous, white-box AI pentester for web applications and APIs. It analyzes your source code, identifies attack vectors, and executes real exploits to prove vulnerabilities before they reach production.","https://github.com/KeygraphHQ/shannon"
"pbakaus/impeccable",42282,2354,2025-11-16,"The design language that makes your AI harness better at design.","https://github.com/pbakaus/impeccable"
"siddharthvaddem/openscreen",39020,2821,2025-10-10,"Create stunning demos for free. Open-source, no subscriptions, no watermarks, and free for commercial use. An alternative to Screen Studio.","https://github.com/siddharthvaddem/openscreen"
"router-for-me/CLIProxyAPI",38695,6398,2025-07-01,"Wrap Antigravity, ChatGPT Codex, Claude Code, Grok Build as an OpenAI/Gemini/Claude/Codex compatible API service, allowing you to enjoy the free Gemini 3.1 Pro, GPT 5.5, Grok 4.3, Claude model through API","https://github.com/router-for-me/CLIProxyAPI"
"jamiepine/voicebox",35889,4300,2026-01-25,"The open-source AI voice studio. Clone, dictate, create.","https://github.com/jamiepine/voicebox"
"hugohe3/ppt-master",34357,2905,2025-12-10,"AI generates a real, editable PowerPoint from any document — native shapes & animations, speaker notes voiced as audio narration, and the option to follow your own .pptx template, not slide images · by Hugo He","https://github.com/hugohe3/ppt-master"
"OpenBMB/VoxCPM",32131,3648,2025-09-16,"VoxCPM2: Tokenizer-Free TTS for Multilingual Speech Generation, Creative Voice Design, and True-to-Life Cloning","https://github.com/OpenBMB/VoxCPM"
"shiyu-coder/Kronos",31581,5419,2025-07-01,"Kronos: A Foundation Model for the Language of Financial Markets","https://github.com/shiyu-coder/Kronos"
"anthropics/claude-plugins-official",31309,3424,2025-11-20,"Official, Anthropic-managed directory of high quality Claude Code Plugins.","https://github.com/anthropics/claude-plugins-official"
"lbjlaq/Antigravity-Manager",29952,3241,2025-11-26,"Professional Antigravity Account Manager & Switcher. One-click seamless account switching for Antigravity Tools. Built with Tauri v2 + React (Rust).专业的 Antigravity 账号管理与切换工具。为 Antigravity 提供一键无缝账号切换功能。","https://github.com/lbjlaq/Antigravity-Manager"
"K-Dense-AI/scientific-agent-skills",29598,3019,2025-10-19,"Turn any AI agent into an AI Scientist. The #1 Agent Skills library for science, used by 160,000+ scientists worldwide. 140 ready-to-use skills plus 100+ scientific databases covering biology, chemistry, medicine, and drug discovery. Compatible with Cursor, Claude Code, Codex, Pi, Antigravity, and the open Agent Skills standard.","https://github.com/K-Dense-AI/scientific-agent-skills"
"iOfficeAI/AionUi",29057,2893,2025-08-07,"Free, local, open-source 24/7 Cowork app for OpenClaw, Hermes Agent, Claude Code, Codex, OpenCode, Gemini CLI and 20+ more CLI | Customize your assistants | Star if you like it!","https://github.com/iOfficeAI/AionUi"
"vercel-labs/agent-skills",28488,2559,2025-12-08,"Vercel's official collection of agent skills","https://github.com/vercel-labs/agent-skills"
"davila7/claude-code-templates",28359,2960,2025-07-04,"CLI tool for configuring and monitoring Claude Code","https://github.com/davila7/claude-code-templates"
"virattt/dexter",27245,3376,2025-10-14,"An autonomous agent for deep financial research","https://github.com/virattt/dexter"
"tobi/qmd",27237,1704,2025-12-08,"mini cli search engine for your docs, knowledge bases, meeting notes, whatever. Tracking current sota approaches while being all local","https://github.com/tobi/qmd"
"firecrawl/open-lovable",27220,5218,2025-08-08,"🔥 Clone and recreate any website as a modern React app in seconds","https://github.com/firecrawl/open-lovable"
"VoltAgent/awesome-agent-skills",26852,2875,2025-10-28,"A curated collection of 1000+ agent skills from official dev teams and the community, compatible with Claude Code, Codex, Gemini CLI, Cursor, and more.","https://github.com/VoltAgent/awesome-agent-skills"
"permissionlesstech/bitchat",26066,2493,2025-07-04,"bluetooth mesh chat, IRC vibes","https://github.com/permissionlesstech/bitchat"
"p-e-w/heretic",25607,2764,2025-09-21,"Fully automatic censorship removal for language models","https://github.com/p-e-w/heretic"
"langchain-ai/deepagents",25332,3577,2025-07-27,"The batteries-included agent harness.","https://github.com/langchain-ai/deepagents"
"HKUDS/DeepTutor",25112,3421,2025-12-28,"DeepTutor: Agent-native Personalized Tutoring. https://deeptutor.info/.","https://github.com/HKUDS/DeepTutor"
"toon-format/toon",24718,1094,2025-10-22,"🎒 Token-Oriented Object Notation (TOON) – Compact, human-readable, schema-aware JSON for LLM prompts. Spec, benchmarks, TypeScript SDK.","https://github.com/toon-format/toon"
"AIDC-AI/Pixelle-Video",23819,3415,2025-11-07,"🚀 AI 全自动短视频引擎 | AI Fully Automated Short Video Engine","https://github.com/AIDC-AI/Pixelle-Video"
"google-labs-code/design.md",23189,1835,2026-04-10,"A format specification for describing a visual identity to coding agents. DESIGN.md gives agents a persistent, structured understanding of a design system.","https://github.com/google-labs-code/design.md"
"PicoTrex/Awesome-Nano-Banana-images",23116,2378,2025-08-28,"A curated collection of fun and creative examples generated with Nano Banana & Nano Banana Pro🍌, Gemini-2.5-flash-image based model. We also release Nano-consistent-150K openly to support the community's development of image generation and unified models(click to website to see our blog)","https://github.com/PicoTrex/Awesome-Nano-Banana-images"
"openai/skills",23023,1563,2025-11-25,"Skills Catalog for Codex","https://github.com/openai/skills"
"VoltAgent/awesome-claude-code-subagents",22574,2628,2025-07-30,"A collection of 100+ specialized Claude Code subagents covering a wide range of development use cases","https://github.com/VoltAgent/awesome-claude-code-subagents"
"slopus/happy",22301,1857,2025-07-18,"Mobile and Web client for Codex and Claude Code, with realtime voice, encryption and fully featured","https://github.com/slopus/happy"
"EveryInc/compound-engineering-plugin",22247,1643,2025-10-09,"Official Compound Engineering plugin for Claude Code, Codex, Cursor, and more","https://github.com/EveryInc/compound-engineering-plugin"
"karpathy/llm-council",21776,3988,2025-11-22,"LLM Council works together to answer your hardest questions","https://github.com/karpathy/llm-council"
"NVIDIA/NemoClaw",21493,2884,2026-03-15,"Run agents like Hermes and OpenClaw more securely inside NVIDIA OpenShell with managed inference","https://github.com/NVIDIA/NemoClaw"
"alibaba/page-agent",20613,1770,2025-09-23,"JavaScript in-page GUI agent. Control web interfaces with natural language.","https://github.com/alibaba/page-agent"
"Nagi-ovo/gemini-voyager",19050,612,2025-10-04,"An all-in-one enhancement suite for Google Gemini & AI Studio - timeline navigation, folder management, prompt library, and chat export in one powerful extension. / Google Gemini & AI Studio 全能增强插件：集成时间轴导航、文件夹管理、提示词库及聊天导出等众多功能。","https://github.com/Nagi-ovo/gemini-voyager"
