"name","stars","forks","created_at","summary","url"
"K-Dense-AI/scientific-agent-skills",28860,2945,2025-10-19,"Turn any AI agent into an AI Scientist. The #1 Agent Skills library for science, used by 160,000+ scientists worldwide. 140 ready-to-use skills plus 100+ scientific databases covering biology, chemistry, medicine, and drug discovery. Compatible with Cursor, Claude Code, Codex, Pi, Antigravity, and the open Agent Skills standard.","https://github.com/K-Dense-AI/scientific-agent-skills"
"iOfficeAI/AionUi",28563,2816,2025-08-07,"Free, local, open-source 24/7 Cowork app for OpenClaw, Hermes Agent, Claude Code, Codex, OpenCode, Gemini CLI and 20+ more CLI | Customize your assistants | Star if you like it!","https://github.com/iOfficeAI/AionUi"
"Wei-Shaw/sub2api",28518,5805,2025-12-18,"Sub2API is an open-source relay platform that unifies Claude, OpenAI, Gemini, and Antigravity subscriptions into a single endpoint. It supports account sharing and cost-sharing, with seamless native tool compatibility.","https://github.com/Wei-Shaw/sub2api"
"davila7/claude-code-templates",28196,2934,2025-07-04,"CLI tool for configuring and monitoring Claude Code","https://github.com/davila7/claude-code-templates"
"virattt/dexter",27128,3373,2025-10-14,"An autonomous agent for deep financial research","https://github.com/virattt/dexter"
"firecrawl/open-lovable",26817,5148,2025-08-08,"🔥 Clone and recreate any website as a modern React app in seconds","https://github.com/firecrawl/open-lovable"
"usestrix/strix",26069,2932,2025-08-05,"Open-source AI hackers to find and fix your app’s vulnerabilities.","https://github.com/usestrix/strix"
"permissionlesstech/bitchat",26036,2495,2025-07-04,"bluetooth mesh chat, IRC vibes","https://github.com/permissionlesstech/bitchat"
"VoltAgent/awesome-agent-skills",25960,2769,2025-10-28,"A curated collection of 1000+ agent skills from official dev teams and the community, compatible with Claude Code, Codex, Gemini CLI, Cursor, and more.","https://github.com/VoltAgent/awesome-agent-skills"
"zai-org/Open-AutoGLM",25573,3986,2025-12-08,"An Open Phone Agent Model & Framework. Unlocking the AI Phone for Everyone","https://github.com/zai-org/Open-AutoGLM"
"QwenLM/qwen-code",25392,2541,2025-06-26,"An open-source AI coding agent that lives in your terminal.","https://github.com/QwenLM/qwen-code"
"p-e-w/heretic",25264,2719,2025-09-21,"Fully automatic censorship removal for language models","https://github.com/p-e-w/heretic"
"gastownhall/beads",24652,1650,2025-10-12,"Beads - A memory upgrade for your coding agent","https://github.com/gastownhall/beads"
"SuperClaude-Org/SuperClaude_Framework",23337,1983,2025-06-22,"A configuration framework that enhances Claude Code with specialized commands, cognitive personas, and development methodologies.","https://github.com/SuperClaude-Org/SuperClaude_Framework"
"AIDC-AI/Pixelle-Video",23160,3306,2025-11-07,"🚀 AI 全自动短视频引擎 | AI Fully Automated Short Video Engine","https://github.com/AIDC-AI/Pixelle-Video"
"PicoTrex/Awesome-Nano-Banana-images",23034,2370,2025-08-28,"A curated collection of fun and creative examples generated with Nano Banana & Nano Banana Pro🍌, Gemini-2.5-flash-image based model. We also release Nano-consistent-150K openly to support the community's development of image generation and unified models(click to website to see our blog)","https://github.com/PicoTrex/Awesome-Nano-Banana-images"
